E:\\nuaa\\1st_Year\\1_code\\LocalGit\\springside\\examples\\showcase\\src\\main\\java\\org\\springside\\examples\\showcase\\xml\\JaxbDemo.java, JAXB Java XML Dom j author calvin xml version encoding UTF user id name roles role admin interests interest movie sports houses house key bj item hosue gz List Role String Map Jaxb JaxbDemo binder setUp Optional  new JaxbBinder User class CollectionWrapper empty objectToXml setId L setName getRoles add getInterests getHouses put toXml System out println Object to Xml result n assertXmlByDom xmlToObject generateXmlByDom fromXml assertEquals Long valueOf getId size get getName toXmlWithListAsRoot kate userList Lists newArrayList Document document DocumentHelper createDocument Element root addElement addAttribute setText addText return asXML doc null try parseText catch DocumentException e fail getMessage getRootElement attribute getValue adminRole selectSingleNode getParent elements getText
E:\\nuaa\\1st_Year\\1_code\\LocalGit\\springside\\examples\\showcase\\src\\main\\java\\org\\springside\\examples\\showcase\\xml\\Role.java, JAXB Java Bean Role id name getId Optional  return empty setId this getName setName toString ToStringBuilder reflectionToString
E:\\nuaa\\1st_Year\\1_code\\LocalGit\\springside\\examples\\showcase\\src\\main\\java\\org\\springside\\examples\\showcase\\xml\\User.java, JAXB Java Bean xml List Object roles role id name admin String interests interest movie Map houses house key bj User password getId Optional  return setId this empty getName setName getPassword setPassword getRoles setRoles getInterests setInterests getHouses setHouses toString ToStringBuilder reflectionToString propOrder HouseMapAdapter class
E:\\nuaa\\1st_Year\\1_code\\LocalGit\\springside\\examples\\showcase\\src\\test\\java\\org\\springside\\examples\\showcase\\data\\UserData.java, author calvin UserData getUserId Optional  return String new UIDGenerator generate null empty getRandomUser userName DataUtils randomName User user setLoginName setName setPlainPassword setEmail springside org cn getRandomUserWithAdminRole Role adminRole getAdminRole getRoleList add role setId Admin
E:\\nuaa\\1st_Year\\1_code\\LocalGit\\springside\\examples\\showcase\\src\\test\\java\\org\\springside\\examples\\showcase\\functional\\ajax\\AjaxTest.java, Ajax Mashup calvin AjaxTest BaseFunctionalTestCase startWebDriver Optional  createWebDriver empty stopWebDriver driver close mashup get BASE URL findElement By linkText click xpath input value SeleniumUtils waitForDisplay id mashupContent assertTrue isTextPresent Hello World
E:\\nuaa\\1st_Year\\1_code\\LocalGit\\springside\\examples\\showcase\\src\\test\\java\\org\\springside\\examples\\showcase\\functional\\BaseFunctionalTestCase.java, Jetty Server TestCase author calvin DataSource WebDriver BaseFunctionalTestCase BASE URL jettyServer dataSourceHolder driver startAll Optional  startJetty fetchDataSource loadDefaultData empty stopAll cleanDefaultData stopJetty JettyUtils buildTestServer Start PORT CONTEXT start stop SpringContextHolder getBean dataSource DbUnitUtils loadData data default xml removeData createWebDriver Properties props PropertiesUtils loadProperties classpath application test properties local SeleniumUtils buildDriver getProperty selenium GroupsTestRunner class
E:\\nuaa\\1st_Year\\1_code\\LocalGit\\springside\\examples\\showcase\\src\\test\\java\\org\\springside\\examples\\showcase\\functional\\common\\UserManagerTest.java, author calvin web xml UserManagerTest BaseFunctionalTestCase AUTOPASS CAPTCHA startWebDriver Optional  createWebDriver empty stopWebDriver driver close editUser get BASE URL findElement By linkText click id editLink SeleniumUtils type name j username admin password captcha xpath input value user foo System out println tagName body getText assertTrue isTextPresent
E:\\nuaa\\1st_Year\\1_code\\LocalGit\\springside\\examples\\showcase\\src\\test\\java\\org\\springside\\examples\\showcase\\functional\\jmx\\JmxTest.java, JMX author calvin JmxTest BaseFunctionalTestCase startWebDriver Optional  createWebDriver empty test driver get BASE URL jmx client action assertEquals default findElement By id nodeName getValue
E:\\nuaa\\1st_Year\\1_code\\LocalGit\\springside\\examples\\showcase\\src\\test\\java\\org\\springside\\examples\\showcase\\functional\\webservice\\rs\\UserResourceServiceTest.java, UserResourceServiceTest BaseFunctionalTestCase client setUpClient Optional  new UserResourceClient setBaseUrl BASE URL rs empty getAllUser List UserDTO userList assertTrue size admin iterator next assertEquals getLoginName searchUserHtml String html Admin div your mother call you searchUserJson
E:\\nuaa\\1st_Year\\1_code\\LocalGit\\springside\\examples\\showcase\\src\\test\\java\\org\\springside\\examples\\showcase\\functional\\webservice\\ws\\BinaryWebServiceTest.java, WebService author calvin SmallImageService LargeImageService BinaryWebServiceTest BaseFunctionalTestCase getSmallImage Optional  String address BASE URL services JaxWsProxyFactoryBean proxyFactory new setAddress setServiceClass SmallImageWebService class imageService create SmallImageResult result getImage assertTrue getImageData length tempFilePath System getProperty java io tmpdir smalllogo jpg OutputStream os FileOutputStream IOUtils write closeQuietly out println empty getLargeImage LargeImageWebService LargeImageResult DataHandler dataHandler largelogo InputStream is getInputStream copy File tempFile
E:\\nuaa\\1st_Year\\1_code\\LocalGit\\springside\\examples\\showcase\\src\\test\\java\\org\\springside\\examples\\showcase\\functional\\webservice\\ws\\SecurityWebServiceTest.java, WS Security PlainText Digest SpringSecurity EndPoint author calvin CXF API Client throws InterruptedException WSS JOutInterceptor Inteceptor factory clientProxy UserWebService jaxws client SecurityWebServiceTest BaseFunctionalTestCaseimplementsApplicationContextAware applicationContext setApplicationContext Optional  this empty getAllUserWithDigestPassword BusFactory setDefaultBus null String address BASE URL services UserServiceWithDigestPassword JaxWsProxyFactoryBean proxyFactory new setAddress setServiceClass class Map Object outProps Maps newHashMap put WSHandlerConstants ACTION USERNAME TOKEN USER admin PASSWORD TYPE WSConstants PW DIGEST CALLBACK REF PasswordCallback wss jOut getOutInterceptors add userWebService create GetAllUserResult result getAllUser assertTrue getUserList size getAllUserWithPlainPassword getBean userServiceWithPlainPassword getUserWithSpringSecurity userServiceWithSpringSecurity GetUserResult getUser assertEquals getLoginName getUserWithSpringSecurityWithoutPermission SpringJUnit ClassRunner DependencyInjectionTestExecutionListener locations webservice cxf xml expected SOAPFaultException
E:\\nuaa\\1st_Year\\1_code\\LocalGit\\springside\\examples\\showcase\\src\\test\\java\\org\\springside\\examples\\showcase\\tools\\Start.java, Jetty Web Console author calvin Start PORT CONTEXT BASE URL main args Optional  Server server JettyUtils buildNormalServer start System out println Hit Enter in console to stop if read stopped empty
E:\\nuaa\\1st_Year\\1_code\\LocalGit\\springside\\examples\\showcase\\src\\test\\java\\org\\springside\\examples\\showcase\\unit\\common\\AccountManagerTest.java, expected exception AccountManagerTest control accountManager mockUserDao setUp Optional  new AccountManager createMock UserDao class setUserDao empty tearDown verify saveUser User admin setId user save replay try fail ServicExcepton not be thrown catch ServiceException e
E:\\nuaa\\1st_Year\\1_code\\LocalGit\\springside\\examples\\showcase\\src\\test\\java\\org\\springside\\examples\\showcase\\unit\\common\\HibernateMappingTest.java, Entity O R Mapping author calvin HibernateMappingTest SpringTxTestCase logger dataSourceHolder sessionFactory loadDefaultData Optional  if null DbUnitUtils loadData dataSource data default xml empty cleanDefaultData removeData allClassMapping Session session openSession try Map metadata getAllClassMetadata for Object o values EntityPersister persister String className getEntityName Query q createQuery from c iterate debug ok finally close locations applicationContext test transactionManager defaultTransactionManager unchecked
E:\\nuaa\\1st_Year\\1_code\\LocalGit\\springside\\examples\\showcase\\src\\test\\java\\org\\springside\\examples\\showcase\\unit\\common\\PostDaoTest.java, PostDao ORM DAO author calvin PostDaoTest SpringTxTestCase dataSourceHolder subjectDao replyDao userDao loadDefaultData Optional  if null DbUnitUtils loadData dataSource data default xml empty cleanDefaultData removeData getSubjectDetail Subject subject getDetailWithReply getSession evict assertEquals getReplyList size Hello World getContent Good Morning get createSubject new setTitle Night setContent setModifyTime Date User user setUser save flush getDetail getId updateSubject Afternoon deleteSubject delete findUniqueBy id assertNull createReply Reply reply GoodAfternoon setSubject updateReply GoodEvening Evening deleteReply locations applicationContext test transactionManager defaultTransactionManager
E:\\nuaa\\1st_Year\\1_code\\LocalGit\\springside\\examples\\showcase\\src\\test\\java\\org\\springside\\examples\\showcase\\unit\\common\\UIDGeneratorTest.java, UIDGeneratorTest generateId Optional  UIDGenerator generator new String id generate null assertTrue length System out println empty
E:\\nuaa\\1st_Year\\1_code\\LocalGit\\springside\\examples\\showcase\\src\\test\\java\\org\\springside\\examples\\showcase\\unit\\common\\UserDaoTest.java, UserDao ORM DAO author calvin TransactionManager init by hql criteria select about record from database UserDaoTest SpringTxTestCase dataSourceHolder userDao loadDefaultData Optional  if null DbUnitUtils loadData dataSource data default xml empty cleanDefaultData removeData eagerFetchCollection int userCount countRowsInTable SS USER List User userList getAllUserWithRoleByDistinctHql assertEquals size assertTrue Hibernate isInitialized get getRoleList getAllUserWithRolesByDistinctCriteria sampleDialect String values createQuery u name where sample list for System out println upDialect Object value up ADMIN uniqueResult Admin batchDisableUser ids Lists newArrayList disableUsers disabled getStatus uidGenerator user UserData getRandomUser save getId length locations applicationContext test transactionManager defaultTransactionManager unchecked
E:\\nuaa\\1st_Year\\1_code\\LocalGit\\springside\\examples\\showcase\\src\\test\\java\\org\\springside\\examples\\showcase\\unit\\common\\UserJdbcDaoTest.java, UserJdbcDao Spring Jdbc Template author calvin UserJdbcDaoTest SpringTxTestCase dataSourceHolder userJdbcDao loadDefaultData Optional  if null DbUnitUtils loadData dataSource data default xml empty cleanDefaultData removeData queryObject User user assertEquals admin getLoginName queryObjectList List resultlist get queryMap Map String Object resultMap L login name queryMapList resultList queryByNamedParameter queryByNamedParameterWithInClause users size createObject id UserData getUserId new setId setLoginName DataUtils randomName setName newUser batchCreateObject list Lists newArrayList searchObject map HashMap searchUserByFreemarkerSqlTemplate assertTrue clear put loginName Admin transactionManager defaultTransactionManager locations applicationContext test common jdbc unchecked
E:\\nuaa\\1st_Year\\1_code\\LocalGit\\springside\\examples\\showcase\\src\\test\\java\\org\\springside\\examples\\showcase\\unit\\jms\\JmsAdvancedTest.java, JmsAdvancedTest SpringContextTestCase notifyMessageProducer advancedJmsTemplate advancedNotifyTopic queueMessage Optional  ThreadUtils sleep MockLog jAppender appender new addToLogger AdvancedNotifyMessageListener class User user setName calvin setEmail sringside org cn sendQueue assertNotNull getFirstLog assertEquals UserName Email ObjectType getMessage empty topicMessage sendTopic topicMessageWithWrongType send MessageCreator public Message createMessage Session session throws JMSException MapMessage message createMapMessage setStringProperty objectType role return assertTrue getAllLogs isEmpty locations applicationContext test xml jms advanced
E:\\nuaa\\1st_Year\\1_code\\LocalGit\\springside\\examples\\showcase\\src\\test\\java\\org\\springside\\examples\\showcase\\unit\\jms\\JmsSimpleTest.java, JmsSimpleTest SpringContextTestCase notifyMessageProducer queueMessage Optional  ThreadUtils sleep MockLog jAppender appender new addToLogger NotifyMessageListener class User user setName calvin setEmail sringside org cn sendQueue logger info sended message assertNotNull getFirstLog assertEquals UserName Email getMessage empty topicMessage sendTopic locations applicationContext test xml jms simple
E:\\nuaa\\1st_Year\\1_code\\LocalGit\\springside\\examples\\showcase\\src\\test\\java\\org\\springside\\examples\\showcase\\unit\\jmx\\JmxClientServiceTest.java, prepare clean JmxClientServiceTest SpringContextTestCase jmxClientService serverConfig Optional  String oldNodeName getNodeName setNodeName node assertEquals setNotificationMailEnabled false isNotificationMailEnabled empty trace startTrace true getTraceStatus stopTrace
E:\\nuaa\\1st_Year\\1_code\\LocalGit\\springside\\examples\\showcase\\src\\test\\java\\org\\springside\\examples\\showcase\\unit\\jmx\\JmxClientTemplateTest.java, springside extension link JmxClientTemplate author calvin Class JmxClientTemplateTest SpringContextTestCase jmxClientTemplate serverConfigMbean setUp Optional  new service jmx rmi jndi localhost jmxrmi createMBeanProxy ServerConfigMBean SERVER CONFIG MBEAN NAME class empty tearDown close accessMBeanAttribute String oldName getNodeName setNodeName foo assertEquals accessMBeanAttributeByReflection getAttribute NodeName setAttribute invokeMBeanMethodByReflection inoke JmxClientService TRACE startTrace WARN invoke Log jMBean LOG J getLoggerLevel java lang Object
E:\\nuaa\\1st_Year\\1_code\\LocalGit\\springside\\examples\\showcase\\src\\test\\java\\org\\springside\\examples\\showcase\\unit\\log\\AsyncJdbcAppenderTest.java, batchSize AsyncJdbcAppenderTest SpringTxTestCase LOG TABLE NAME logToDb Optional  Logger dbLogger getLogger DBLogExample int oldLogsCount this countRowsInTable i for info helloworld ThreadUtils sleep assertEquals empty performanceTest totalCount tps Date batchBegin new if batchEnd long sleepMillSecs getTime Thread locations applicationContext test xml log transactionManager defaultTransactionManager Only performance Test
E:\\nuaa\\1st_Year\\1_code\\LocalGit\\springside\\examples\\showcase\\src\\test\\java\\org\\springside\\examples\\showcase\\unit\\log\\TraceUtilsTest.java, begin trace log message end TraceUtilsTest logger test Optional  MockLog jAppender appender new addToLogger class TraceUtils beginTrace assertNotNull MDC get TRACE ID KEY assertEquals LENGTH String length info getAllLogs getMessage endTrace assertNull empty
E:\\nuaa\\1st_Year\\1_code\\LocalGit\\springside\\examples\\showcase\\src\\test\\java\\org\\springside\\examples\\showcase\\unit\\queue\\QueueTest.java, QueueTest MockConsumerTask QueueConsumer backup Optional  String queueName testBackup filePath System getProperty java io tmpdir File separator queue BlockingQueue QueuesHolder getQueue Date date new offer task setQueueName start stop file assertEquals true exists ObjectInputStream oos FileInputStream List list ArrayList while try Object obj readObject add catch EOFException e break close delete size get empty restore testRestore newQueue drainTo false run unchecked
E:\\nuaa\\1st_Year\\1_code\\LocalGit\\springside\\examples\\showcase\\src\\test\\java\\org\\springside\\examples\\showcase\\unit\\report\\ExcelExportActionTest.java, ExcelExportAction Excel author calvin Cell ExcelExportActionTest test Optional  action new Workbook wb ReflectionUtils invokeMethod exportExcelWorkbook null CellReference cr B cell getSheetAt getRow getCell getCol assertEquals getNumericCellValue cellTotal FormulaEvaluator evaluator getCreationHelper createFormulaEvaluator evaluate getNumberValue empty
E:\\nuaa\\1st_Year\\1_code\\LocalGit\\springside\\examples\\showcase\\src\\test\\java\\org\\springside\\examples\\showcase\\unit\\schedule\\JdkExecutorJobTest.java, logger appender JdkExecutorJobTest SpringTxTestCase scheduleJob Optional  DbUnitUtils loadData dataSource data default xml MockLog jAppender new addToLogger JdkExecutorJob class ThreadUtils sleep assertEquals getAllLogs size There are user in database getFirstLog getMessage removeData empty locations applicationContext test schedule executor transactionManager defaultTransactionManager
E:\\nuaa\\1st_Year\\1_code\\LocalGit\\springside\\examples\\showcase\\src\\test\\java\\org\\springside\\examples\\showcase\\unit\\schedule\\QuartzClusterableJobTest.java, Quartz Timer Job author calvin logger appender QuartzClusterableJobTest SpringTxTestCase scheduleJob Optional  DbUnitUtils loadData dataSource data default xml MockLog jAppender new addToLogger QuartzClusterableJob class ThreadUtils sleep assertEquals getAllLogs size There are user in database print by s job getFirstLog getMessage removeData empty transactionManager defaultTransactionManager
E:\\nuaa\\1st_Year\\1_code\\LocalGit\\springside\\examples\\showcase\\src\\test\\java\\org\\springside\\examples\\showcase\\unit\\security\\UserDetailsServiceImplTest.java, UserDetailsServiceImplTest control userDetailsService mockAccountManager setUp Optional  new UserDetailsServiceImpl createMock AccountManager class setAccountManager empty tearDown verify loadUserExist User user setLoginName admin setShaPassword ShaPasswordEncoder encodePassword null Role role setName getRoleList add EasyMock expect findUserByLoginName andReturn replay OperatorDetails operator loadUserByUsername getLoginName assertEquals getUsername getPassword getAuthorities size GrantedAuthorityImpl ROLE iterator next assertNotNull getLoginTime loadUserByWrongUserName foo assertNull expected UsernameNotFoundException
E:\\nuaa\\1st_Year\\1_code\\LocalGit\\springside\\examples\\showcase\\src\\test\\java\\org\\springside\\examples\\showcase\\unit\\web\\CacheControlHeaderFilterTest.java, CacheControlHeaderFilterTest test Optional  MockFilterConfig config new MockFilterChain chain MockHttpServletRequest request MockHttpServletResponse response addInitParameter expiresSeconds CacheControlHeaderFilter filter init doFilter assertEquals private max age getHeader Cache Control empty
E:\\nuaa\\1st_Year\\1_code\\LocalGit\\springside\\modules\\core\\src\\main\\java\\org\\springside\\modules\\log\\Log4jMBean.java, JMX Logger Appender MBean author calvin Log jMbean Root DEBUG jMBean LOG J MBEAN NAME mbeanLogger getRootLoggerLevel Optional  root getRootLogger return getLevel toString setRootLoggerLevel newLevel Level level toLevel setLevel info getLoggerLevel loggerName logger getLogger getEffectiveLevel setLoggerLevel objectName description j Management Bean Logging of the Get logging ManagedOperationParameter name Set new to newlevel New
E:\\nuaa\\1st_Year\\1_code\\LocalGit\\springside\\modules\\core\\src\\main\\java\\org\\springside\\modules\\log\\MockLog4jAppender.java, List Appender addToLogger appender logger author calvin append log AppenderSkeleton see close requiresLayout MockLog jAppender logs getFirstLog Optional  if isEmpty return null get getLastLog size getAllLogs clearLogs clear loggerName Logger getLogger addAppender this loggerClass removeFromLogger removeAppender event add false
E:\\nuaa\\1st_Year\\1_code\\LocalGit\\springside\\modules\\core\\src\\main\\java\\org\\springside\\modules\\orm\\hibernate\\HibernateDao.java, SpringSide Hibernat DAO Service param T PK author calvin PropertyFilter Dao Class eg public class UserDao extends HibernateDao User Long userDao new sessionFactory HQL page orderBy hql values return Criteria criterions Criterion Query hibernate firstResult count Hql select order by Projection ResultTransformer OrderBy Count matchType MatcheType enum MatchType criterion or Serializable extendsSimpleHibernateDao getAll Optional  findPage Assert notNull q createQuery if isAutoCount long totalCount countHqlResult setTotalCount setPageParameterToQuery List result list setResult c createCriteria countCriteriaResult setPageParameterToCriteria isTrue getPageSize Page Size must larger than zero setFirstResult getFirst setMaxResults isOrderBySetted String orderByArray StringUtils split getOrderBy orderArray getOrder length for int i ASC equals addOrder Order asc else desc countHql prepareCountHql try findUnique catch Exception e throw RuntimeException can t be auto is orgHql fromHql from substringAfter substringBefore empty CriteriaImpl impl projection getProjection transformer getResultTransformer OrderEntry orderEntries null ReflectionUtils getFieldValue setFieldValue ArrayList logger error getMessage totalCountObject setProjection Projections rowCount uniqueResult setResultTransformer CriteriaSpecification ROOT ENTITY findBy propertyName value buildCriterion find filters buildCriterionByPropertyFilter propertyValue hasText switch case EQ Restrictions eq break LIKE like MatchMode ANYWHERE LE le LT lt GE ge GT gt criterionList filter hasMultiProperties getPropertyName getMatchValue getMatchType add Disjunction disjunction getPropertyNames toArray size super entityClass unchecked
E:\\nuaa\\1st_Year\\1_code\\LocalGit\\springside\\modules\\core\\src\\main\\java\\org\\springside\\modules\\orm\\hibernate\\IgnorePrefixReverseEngineeringStrategy.java, Hibernate Tools Entity POJO Class T ACCT USER TAcctUser User author calvin IgnorePrefixReverseEngineeringStrategy DelegatingReverseEngineeringStrategy tableToClassName tableIdentifier Optional  String delegateResult super return ignorePrefix empty int lastDotIndex lastIndexOf packageName substring className getPrefixLength fullClassName delegate
E:\\nuaa\\1st_Year\\1_code\\LocalGit\\springside\\modules\\core\\src\\main\\java\\org\\springside\\modules\\orm\\hibernate\\SimpleHibernateDao.java, Hibernate API DAO Service Spring Petlinc HibernateTemplate param T PK author calvin Dao Class eg public class UserDao extends SimpleHibernateDao User Long userDao new sessionFactory Autowired SessionFactory SesionFactory Session entity session id transient HQL values return Query find Criteria criterions Criterion load Proxy View initialize user getRoles getDescription Description Flush distinct transformer value orgValue Serializable logger entityClass getSessionFactory Optional  setSessionFactory this getSession getCurrentSession save Assert notNull saveOrUpdate debug delete get is getSimpleName ids Restrictions in getIdName getAll orderByProperty isAsc c createCriteria if addOrder Order asc else desc list findBy propertyName hasText criterion eq findUniqueBy uniqueResult hql createQuery findUnique X batchExecute executeUpdate queryString query null for int i length setParameter setProperties criteria add initProxyObject proxy flush setResultTransformer CriteriaSpecification DISTINCT ROOT ENTITY ClassMetadata meta getClassMetadata getIdentifierPropertyName isPropertyUnique newValue oldValue equals true Object object ReflectionUtils getSuperClassGenricType getClass unchecked
E:\\nuaa\\1st_Year\\1_code\\LocalGit\\springside\\modules\\core\\src\\main\\java\\org\\springside\\modules\\orm\\Page.java, ORM param T Page author calvin setPageNo setPageSize pageNo pageSize setOrderBy order desc asc setOrder count false setAutoCount totalCount ASC DESC orderBy autoCount result getPageNo Optional  return this if thePageNo getPageSize thePageSize getFirst getOrderBy theOrderBy getOrder String lowcaseOrder StringUtils lowerCase orders split for orderStr equals throw new IllegalArgumentException theOrder isOrderBySetted isNotBlank isAutoCount theAutoCount getResult setResult getTotalCount setTotalCount getTotalPages long isHasNext getNextPage else isHasPre getPrePage empty
E:\\nuaa\\1st_Year\\1_code\\LocalGit\\springside\\modules\\core\\src\\main\\java\\org\\springside\\modules\\orm\\PropertyFilter.java, ORM author calvin OR param filterName eg LIKES NAME LOGIN value HttpRequest PropertyFilter Filter filter see buildFromHttpRequest HttpServletRequest String EQS name email request Map SEPARATOR matchType matchValue propertyClass propertyNames Optional  return filterPrefix List filterList new ArrayList Object filterParamMap ServletUtils getParametersStartingWith for Entry entry entrySet getKey getValue if StringUtils isNotBlank add getPropertyClass getMatchType getMatchValue getPropertyNames getPropertyName Assert isTrue length There are not only one property in this hasMultiProperties empty firstPart substringBefore matchTypeCode substring propertyTypeCode try Enum valueOf MatchType class catch RuntimeException e throw IllegalArgumentException PropertyType propertyNameStr substringAfter splitByWholeSeparator ConvertUtils convertStringToObject
E:\\nuaa\\1st_Year\\1_code\\LocalGit\\springside\\modules\\core\\src\\main\\java\\org\\springside\\modules\\security\\springsecurity\\SpringSecurityUtils.java, SpringSecurity x author calvin User null IP true UserDetails Security Context param userDetails request Null Authentication SecurityContext SpringSecurityUtils getCurrentUser Optional  authentication getAuthentication if return Object principal getPrincipal instanceof T getCurrentUserName getName getCurrentUserIp details getDetails WebAuthenticationDetails webDetails getRemoteAddress hasAnyRole roles false Collection GrantedAuthority grantedAuthorityList getAuthorities for String role authority equals getAuthority saveUserDetailsToContext PreAuthenticatedAuthenticationToken new getPassword setDetails SecurityContextHolder getContext setAuthentication context unchecked
E:\\nuaa\\1st_Year\\1_code\\LocalGit\\springside\\modules\\core\\src\\main\\java\\org\\springside\\modules\\test\\groups\\Groups.java, TestNG Groups annotation author freeman calvin ALL RetentionPolicy RUNTIME ElementType METHOD TYPE
