E:\\nuaa\\1st_Year\\1_code\\LocalGit\\springside\\examples\\showcase\\src\\main\\java\\org\\springside\\examples\\showcase\\log\\trace\\TraceUtils.java, MDC traceID trace ID grep log j properties ConversionPattern X traceId appender stdout layout d c m n author calvin Trace TraceUtils TRACE KEY LENGTH beginTrace Optional  String RandomStringUtils randomAlphanumeric put endTrace remove
E:\\nuaa\\1st_Year\\1_code\\LocalGit\\springside\\examples\\showcase\\src\\main\\java\\org\\springside\\examples\\showcase\\orm\\hibernate\\AuditableEntity.java, Entity author calvin save update AuditableEntity IdEntity createTime createBy lastModifyTime lastModifyBy getCreateTime Optional  return setCreateTime this empty getCreateBy setCreateBy getLastModifyTime setLastModifyTime getLastModifyBy setLastModifyBy updatable false insertable
E:\\nuaa\\1st_Year\\1_code\\LocalGit\\springside\\examples\\showcase\\src\\main\\java\\org\\springside\\examples\\showcase\\orm\\hibernate\\AuditListener.java, entity Hibernate EventListener hibernate saveOrUpdate AuditableEntity author calvin AuditListener serialVersionUID logger onSaveOrUpdate event Optional  Object object getObject if instanceof String loginName SpringSecurityUtils getCurrentUserName getId null setCreateTime new Date setCreateBy else setLastModifyTime setLastModifyBy info ID getEntityName empty
E:\\nuaa\\1st_Year\\1_code\\LocalGit\\springside\\examples\\showcase\\src\\main\\java\\org\\springside\\examples\\showcase\\orm\\hibernate\\H2ExtDialect.java, H Dialect author calvin up uppper where u name FOO sample ExtDialect  super registerFunction new StandardSQLFunction upper SQLFunctionTemplate Hibernate DOUBLE rand true Optional empty
E:\\nuaa\\1st_Year\\1_code\\LocalGit\\springside\\examples\\showcase\\src\\main\\java\\org\\springside\\examples\\showcase\\queue\\BlockingConsumer.java, Queue Consumer processMessage Ignore BlockingConsumer QueueConsumer run Optional  try while Thread currentThread isInterrupted Object message queue take catch InterruptedException e finally clean empty
E:\\nuaa\\1st_Year\\1_code\\LocalGit\\springside\\examples\\showcase\\src\\main\\java\\org\\springside\\examples\\showcase\\queue\\PeriodConsumer.java, Queue Consumer processMessageList Ignore PeriodConsumer QueueConsumer batchSize period setBatchSize Optional  this setPeriod checkSetting Assert isTrue empty run try while Thread currentThread isInterrupted List list new ArrayList queue drainTo if sleep catch InterruptedException e finally clean messageList unchecked
E:\\nuaa\\1st_Year\\1_code\\LocalGit\\springside\\examples\\showcase\\src\\main\\java\\org\\springside\\examples\\showcase\\queue\\QueueConsumer.java, Queue QueueConsumer TODO see QueuesHolder author calvin backup restore JVM queue java io tmpdir queueName logger shutdownTimeout persistence persistencePath persistenceLock executor setQueueName Optional  this setShutdownTimeout setPersistence setPersistencePath start getQueue if synchronized restoreQueue Executors newSingleThreadExecutor new CustomizableThreadFactory Consumer execute stop try ThreadUtils normalShutdown TimeUnit MILLISECONDS finally backupQueue List list ArrayList drainTo isEmpty ObjectOutputStream oos null File file getPersistenceDir getPersistenceFileName BufferedOutputStream FileOutputStream for Object message writeObject info size getAbsolutePath close else debug ObjectInputStream ois exists BufferedInputStream FileInputStream int count while true readObject put catch EOFException e break delete parentDir separator mkdirs return unchecked
E:\\nuaa\\1st_Year\\1_code\\LocalGit\\springside\\examples\\showcase\\src\\main\\java\\org\\springside\\examples\\showcase\\queue\\QueuesHolder.java, BlockingQueue Map author calvin QueueManager queueName Null JMX Integer NOSONAR QueuesHolder QUEUEHOLDER MBEAN NAME queueMap queueSize getQueue Optional  queue get if null newQueue new LinkedBlockingQueue putIfAbsent return getQueueLength size setQueueSize unchecked objectName description Queues Holder Bean Get message count in ManagedOperationParameter name Queue
E:\\nuaa\\1st_Year\\1_code\\LocalGit\\springside\\examples\\showcase\\src\\main\\java\\org\\springside\\examples\\showcase\\report\\ChartDataAction.java, FlashChart Amcharts CVS XML Action author calvin CSV Dom j chart series value xid graphs graph gid color  DBD url showcase report flashchart drilldown action id ChartDataAction ActionSupport serialVersionUID Optional TemperatureAnomaly temperatureAnomalyArray DummyDataFetcher getDummyData StringBuilder output new for data append getYear getAnomaly getSmoothed n Struts Utils render text csv toString return null String getRequest getContextPath Document document DocumentHelper createDocument Element root addElement graphAnomaly addAttribute graphSmoothed int i length valueOf addText graphAnomalyValue if HttpServletResponse response getResponse setContentType xml charset utf OutputFormat format createCompactFormat XMLWriter xmlWriter getWriter write close
E:\\nuaa\\1st_Year\\1_code\\LocalGit\\springside\\examples\\showcase\\src\\main\\java\\org\\springside\\examples\\showcase\\report\\DummyDataFetcher.java, author calvin DummyDataFetcher TemperatureAnomaly year anomaly smoothed getDummyData Optional  return new empty getYear setYear this getAnomaly setAnomaly getSmoothed setSmoothed
E:\\nuaa\\1st_Year\\1_code\\LocalGit\\springside\\examples\\showcase\\src\\main\\java\\org\\springside\\examples\\showcase\\report\\ExcelExportAction.java, POI Excel Action author calvin Workbook Cell Style Column ExcelExportAction ActionSupport serialVersionUID styles rowIndex execute Optional  wb exportExcelWorkbook HttpServletResponse response Struts Utils getResponse setContentType ServletUtils EXCEL TYPE setFileDownloadHeader xls write getOutputStream flush return null TemperatureAnomaly temperatureAnomalyArray DummyDataFetcher getDummyData new HSSFWorkbook createStyles Sheet s createSheet createFreezePane autoSizeColumn generateTitle generateHeader generateContent generateTotals empty Row r createRow c createCell setCellValue Temperature Anomaly setCellStyle get header addMergedRegion CellRangeAddress valueOf A C CellStyle headerStyle Year Smoothed temperatureAnomalys dateCellStyle dateCell numberCellStyle numberCell for temperatureAnomaly DateTime getYear toDate getAnomaly getSmoothed totalStyle total n setCellFormula SUM B Maps newHashMap DataFormat df createDataFormat Font normalFont createFont setFontHeightInPoints short boldFont setBoldweight BOLDWEIGHT BOLD blueBoldFont setColor IndexedColors BLUE getIndex createCellStyle setFont put setDataFormat getFormat yyyy setBorder setWrapText true setAlignment ALIGN RIGHT style setBorderRight BORDER THIN setRightBorderColor BLACK setBorderLeft setLeftBorderColor setBorderTop setTopBorderColor setBorderBottom setBottomBorderColor report excel
E:\\nuaa\\1st_Year\\1_code\\LocalGit\\springside\\examples\\showcase\\src\\main\\java\\org\\springside\\examples\\showcase\\rs\\client\\UserResourceClient.java, Jersey Client User REST Mini Service author calvin SpringSecurity HttpBasic html DTO JSON UserResourceClient logger client setBaseUrl baseUrl Optional  jerseyClient create new DefaultClientConfig resource empty getAllUser String authentication ServletUtils encodeHttpBasic admin return path users header AUTHENTICATION HEADER accept MediaType APPLICATION get GenericType List UserDTO getUser id class searchUserHtml name search queryParam format searchUserJson json ObjectMapper mapper try user readValue catch JsonParseException e error response JsonMappingException null
E:\\nuaa\\1st_Year\\1_code\\LocalGit\\springside\\examples\\showcase\\src\\main\\java\\org\\springside\\examples\\showcase\\rs\\dto\\RoleDTO.java, Web Service Role DTO link UserDTO author calvin RoleDTO id name getId Optional  return empty setId this getName setName toString ToStringBuilder reflectionToString
E:\\nuaa\\1st_Year\\1_code\\LocalGit\\springside\\examples\\showcase\\src\\main\\java\\org\\springside\\examples\\showcase\\rs\\dto\\UserDTO.java, Web Service User DTO author calvin toString UserDTO id loginName name email roleList getId Optional  return empty setId value getLoginName setLoginName getName setName getEmail setEmail getRoleList setRoleList this ToStringBuilder reflectionToString
E:\\nuaa\\1st_Year\\1_code\\LocalGit\\springside\\examples\\showcase\\src\\main\\java\\org\\springside\\examples\\showcase\\rs\\server\\UserResourceService.java, REST Mini Service author calvin SpringSecurity QueryParam Response html JSON HttpServletRequest UriInfo HttpHeaders Http Header URL WebApplicationException UserResourceService CHARSET logger accountManager dozer getAllUser Optional  try List User entityList getAllUserWithRole UserDTO dtoList Lists newArrayList for userEntity add map class return catch RuntimeException e error getMessage throw new getUser id entity getInitedUser dto ObjectNotFoundException String message buildException Status NOT FOUND searchUser name format searchLoadedUserByName if equals div getName your mother call you ok MediaType TEXT HTML build else APPLICATION searchUserByFlexibleParameter request ui hh MultivaluedMap queryParams getQueryParameters userName null getRequestHeader get getFirst status type text plain users ROLE XML PathParam search
E:\\nuaa\\1st_Year\\1_code\\LocalGit\\springside\\examples\\showcase\\src\\main\\java\\org\\springside\\examples\\showcase\\schedule\\JdkExecutorJob.java, ScheduledThreadPoolExecutor scheduleAtFixedRatefixRate schedule scheduleAtFixedDelay gracefulShutdown JdkExecutorJob logger initialDelay period shutdownTimeout scheduledExecutorService accountManager start Optional  Assert isTrue Runnable task new DelegatingErrorHandlingRunnable this TaskUtils LOG AND SUPPRESS ERROR HANDLER Executors newSingleThreadScheduledExecutor CustomizableThreadFactory scheduleAtFixedRate TimeUnit SECONDS empty stop ThreadUtils normalShutdown run long userCount getUserCount info There are user in database setInitialDelay setPeriod setShutdownTimeout setAccountManager
E:\\nuaa\\1st_Year\\1_code\\LocalGit\\springside\\examples\\showcase\\src\\main\\java\\org\\springside\\examples\\showcase\\schedule\\QuartzClusterableJob.java, Spring Quartz JobDetailBean Job XXManager QuartzJobBean applicationContext SchedulerFactoryBean QuartzClusterableJob logger setApplicationContext Optional  this executeInternal ctx AccountManager accountManager getBean class Map config timerJobConfig long userCount getUserCount String nodeName get info There are user in database print by s job unchecked
E:\\nuaa\\1st_Year\\1_code\\LocalGit\\springside\\examples\\showcase\\src\\main\\java\\org\\springside\\examples\\showcase\\schedule\\QuartzJob.java, Spring Quartz MethodInvokingJobDetailFactoryBean Bean QuartzJob logger accountManager execute Optional  long userCount getUserCount info There are user in database
E:\\nuaa\\1st_Year\\1_code\\LocalGit\\springside\\examples\\showcase\\src\\main\\java\\org\\springside\\examples\\showcase\\schedule\\SpringCronJob.java, Spring ThreadPoolTaskScheduler Cron gracefulShutdown SpringCronJob logger cronExpression shutdownTimeout threadPoolTaskScheduler accountManager start Optional  Assert hasText new setThreadNamePrefix initialize schedule this CronTrigger empty stop ScheduledExecutorService scheduledExecutorService getScheduledExecutor ThreadUtils normalShutdown TimeUnit SECONDS run long userCount getUserCount info There are user in database setCronExpression setShutdownTimeout setAccountManager
E:\\nuaa\\1st_Year\\1_code\\LocalGit\\springside\\examples\\showcase\\src\\main\\java\\org\\springside\\examples\\showcase\\security\\AutoLoginFilter.java, filter author kevin ericsson com AutoLoginFilter GenericFilterBean userDetailsService enabled defaultUserName doFilter request response chain Optional  if SpringSecurityUtils getCurrentUser null UserDetails userDetails loadUserByUsername throw new RuntimeException saveUserDetailsToContext HttpServletRequest empty setUserDetailsService this setEnabled setDefaultUserName
E:\\nuaa\\1st_Year\\1_code\\LocalGit\\springside\\examples\\showcase\\src\\main\\java\\org\\springside\\examples\\showcase\\security\\OperatorDetails.java, SpringSecurity WebAuthenticationDetails author calvin OperatorDetails User serialVersionUID loginTime roleList getLoginTime Optional  return empty setLoginTime this getRoleList setRoleList username password enabled accountNonExpired credentialsNonExpired accountNonLocked authorities super
E:\\nuaa\\1st_Year\\1_code\\LocalGit\\springside\\examples\\showcase\\src\\main\\java\\org\\springside\\examples\\showcase\\security\\UserDetailsServiceImpl.java, SpringSecurity UserDetailsService Detail User loginTime author calvin showcase true UserDetailsServiceImpl accountManager loadUserByUsername username Optional  user findUserByLoginName if null throw new UsernameNotFoundException Set GrantedAuthority grantedAuths obtainGrantedAuthorities boolean enabled accountNonExpired credentialsNonExpired accountNonLocked OperatorDetails userDetails getLoginName getShaPassword setLoginTime Date setRoleList getRoleList return authSet Sets newHashSet for Role role add GrantedAuthorityImpl ROLE getName setAccountManager this empty readOnly
E:\\nuaa\\1st_Year\\1_code\\LocalGit\\springside\\examples\\showcase\\src\\main\\java\\org\\springside\\examples\\showcase\\time\\DateUtils.java, Utils DateUtils getAge birthDate Optional  return Years yearsBetween new DateTime getYears formatDateTime dateTime style lang DateTimeFormatter formatter DateTimeFormat forStyle M withLocale Locale toString
E:\\nuaa\\1st_Year\\1_code\\LocalGit\\springside\\examples\\showcase\\src\\main\\java\\org\\springside\\examples\\showcase\\time\\JodaDemo.java, DateTime System UTC sameMills TimeStamp M L JodaDemo main args Optional  testTimeZone testLocale testGetAge empty out println String format yyyy MM dd HH mm ss zZZ new getMillis currentTimeMillis fooDate toString zoneWithUTC withZone DateTimeZone dateString DateTimeFormatter fmt DateTimeFormat forPattern parserResult forID US Pacific parseDateTime Locale dateTime S DateUtils formatDateTime SS zh LL XL FF en formatter forStyle ML withLocale Mix print Date only now oneYearsAgo minusYears plusDays twoYearsAgo Assert isTrue getAge
E:\\nuaa\\1st_Year\\1_code\\LocalGit\\springside\\examples\\showcase\\src\\main\\java\\org\\springside\\examples\\showcase\\web\\CacheControlHeaderFilter.java, Response Header Filter eg web xml filter name cacheControlHeaderFilter class org springside modules CacheControlHeaderFilter init param expiresSeconds value mapping url pattern img author calvin see FilterConfig destroy PARAM EXPIRES SECONDS doFilter req res chain Optional  ServletUtils setExpiresHeader HttpServletResponse empty filterConfig String expiresSecondsParam getInitParameter if null Long valueOf else ONE YEAR
E:\\nuaa\\1st_Year\\1_code\\LocalGit\\springside\\examples\\showcase\\src\\main\\java\\org\\springside\\examples\\showcase\\web\\RemoteContentServlet.java, Servlet Apache HttpClient contentUrl URL remote content http  A F Flocalhost Fshowcase Fimg Flogo jpg author calvin Header byte InputStream OutputStream k Input Output Stream Create and initialize HTTP parameters scheme registry an with the ThreadSafeClientConnManager RemoteContentServlet HttpServlet serialVersionUID logger httpClient doGet request response Optional String getParameter if StringUtils isBlank sendError HttpServletResponse SC BAD REQUEST parameter is required HttpEntity entity fetchContent null NOT FOUND not found return setContentType getContentType getValue getContentLength setContentLength int input getContent output getOutputStream try IOUtils copy flush finally closeQuietly empty targetUrl HttpGet httpGet new HttpContext context BasicHttpContext HttpResponse remoteResponse execute getEntity catch Exception e error fetch abort init HttpParams params BasicHttpParams ConnManagerParams setMaxTotalConnections HttpProtocolParams setVersion HttpVersion SchemeRegistry schemeRegistry register Scheme PlainSocketFactory getSocketFactory ClientConnectionManager cm DefaultHttpClient destroy getConnectionManager shutdown
E:\\nuaa\\1st_Year\\1_code\\LocalGit\\springside\\examples\\showcase\\src\\main\\java\\org\\springside\\examples\\showcase\\web\\StaticContentServlet.java, Servlet Gzip org springside examples showcase cache Ehcache Map static content contentPath img logo jpg download true author calvin Mime Etag ModifiedSince Header MIME OutputStream outputstream http trunked length byte  k Input Output Stream gzip Http header GZIPOutputStream applicationContext mimeTypes css Content StaticContentServlet HttpServlet ContentInfo serialVersionUID GZIP TYPES MINI LENGTH mimetypesFileTypeMap file fileName mimeType lastModified etag needGzip doGet request response Optional String getParameter if StringUtils isBlank sendError HttpServletResponse SC BAD REQUEST parameter is required return contentInfo getContentInfo ServletUtils checkIfModifiedSince checkIfNoneMatchEtag setExpiresHeader ONE YEAR SECONDS setLastModifiedHeader setEtag setContentType null setFileDownloadHeader output checkAccetptGzip buildGzipOutputStream else setContentLength getOutputStream FileInputStream input new try IOUtils copy flush finally closeQuietly empty acceptEncoding getHeader Accept Encoding contains setHeader Vary init WebApplicationContextUtils getWebApplicationContext getServletContext MimetypesFileTypeMap addMimeTypes text realFilePath getRealPath File getName int W getContentType ArrayUtils false
E:\\nuaa\\1st_Year\\1_code\\LocalGit\\springside\\examples\\showcase\\src\\main\\java\\org\\springside\\examples\\showcase\\ws\\client\\PasswordCallback.java, WS Security Handler handler Digest author calvin admin user PasswordCallback handle callbacks Optional  WSPasswordCallback pc if equals getIdentifier setPassword else empty
E:\\nuaa\\1st_Year\\1_code\\LocalGit\\springside\\examples\\showcase\\src\\main\\java\\org\\springside\\examples\\showcase\\ws\\server\\dto\\UserDTO.java, Web Service User DTO author calvin toString UserDTO serialVersionUID id loginName name getId Optional  return empty setId value getLoginName setLoginName getName setName ToStringBuilder reflectionToString this namespace WsConstants NS
E:\\nuaa\\1st_Year\\1_code\\LocalGit\\springside\\examples\\showcase\\src\\main\\java\\org\\springside\\examples\\showcase\\ws\\server\\impl\\LargeImageWebServiceImpl.java, LargeImageWebService see author calvin getImage applicationContext Web activation DataHandler Streaming LargeImageWebServiceImpl logger Optional  try File image getResource img logo jpg getFile DataSource dataSource new FileDataSource dataHandler LargeImageResult result setImageData return catch IOException e error getMessage WSResult buildResult class IMAGE ERROR Image reading setApplicationContext this empty serviceName LargeImageService portName LargeImageServicePort endpointInterface org springside examples showcase ws server targetNamespace WsConstants NS
E:\\nuaa\\1st_Year\\1_code\\LocalGit\\springside\\examples\\showcase\\src\\main\\java\\org\\springside\\examples\\showcase\\ws\\server\\impl\\security\\DigestPasswordCallback.java, WS Security Digest Handler author calvin DigestPasswordCallback accountManager handle callbacks Optional  WSPasswordCallback pc String loginName getIdentifier User user findUserByLoginName if null throw new IOException wrong login name setPassword getPlainPassword setAccountManager this empty
E:\\nuaa\\1st_Year\\1_code\\LocalGit\\springside\\examples\\showcase\\src\\main\\java\\org\\springside\\examples\\showcase\\ws\\server\\impl\\security\\PlainPasswordCallback.java, WS Security Digest Handler author calvin WSPasswordCallback sha PlainPasswordCallback accountManager handle callbacks Optional  pc PasswordEncoder encoder new ShaPasswordEncoder User user findUserByLoginName getIdentifier if null throw IOException wrong login name isPasswordValid getShaPassword getPassword password for setAccountManager this empty
E:\\nuaa\\1st_Year\\1_code\\LocalGit\\springside\\examples\\showcase\\src\\main\\java\\org\\springside\\examples\\showcase\\ws\\server\\impl\\SmallImageWebServiceImpl.java, SmallImageWebService see author calvin getImage applicationContext getResource Web SmallImageWebServiceImpl logger Optional  InputStream is null try img logo jpg getInputStream byte imageBytes IOUtils toByteArray SmallImageResult result new setImageData return catch IOException e error getMessage WSResult buildResult class IMAGE ERROR Image reading finally closeQuietly setApplicationContext this empty serviceName SmallImageService portName SmallImageServicePort endpointInterface org springside examples showcase ws server targetNamespace WsConstants NS
E:\\nuaa\\1st_Year\\1_code\\LocalGit\\springside\\examples\\showcase\\src\\main\\java\\org\\springside\\examples\\showcase\\ws\\server\\impl\\UserWebServiceImpl.java, UserWebService author sky calvin serviceName portName WSDL endpointInterface Interface see getUser getAllUser User UserDTO SpringSecurity UserWebServiceImpl logger accountManager dozer Optional  try List userEntityList getAllUserWithRole userDTOList Lists newArrayList for userEntity add map class GetAllUserResult result new setUserList return catch RuntimeException e error getMessage WSResult buildDefaultErrorResult id StopWatch totalStopWatch Slf JStopWatch Assert notNull IllegalArgumentException buildResult GetUserResult PARAMETER ERROR dbStopWatch GetUser fetchDB entity getInitedUser stop dto setUser GerUser total success ObjectNotFoundException String message failure UserService UserServicePort org springside examples showcase ws server targetNamespace WsConstants NS ROLE Admin
E:\\nuaa\\1st_Year\\1_code\\LocalGit\\springside\\examples\\showcase\\src\\main\\java\\org\\springside\\examples\\showcase\\ws\\server\\LargeImageWebService.java, MTOM Streaming DataHandler author calvin LargeImageWebService getImage Optional empty name LargeImageService targetNamespace WsConstants NS
E:\\nuaa\\1st_Year\\1_code\\LocalGit\\springside\\examples\\showcase\\src\\main\\java\\org\\springside\\examples\\showcase\\ws\\server\\result\\GetAllUserResult.java, GetAllUser author calvin GetAllUserResult WSResultimplementsSerializable serialVersionUID userList getUserList Optional  return empty setUserList this name namespace WsConstants NS user
E:\\nuaa\\1st_Year\\1_code\\LocalGit\\springside\\examples\\showcase\\src\\main\\java\\org\\springside\\examples\\showcase\\ws\\server\\result\\GetUserResult.java, GetUser author calvin GetUserResult WSResult user getUser Optional  return empty setUser this name namespace WsConstants NS
E:\\nuaa\\1st_Year\\1_code\\LocalGit\\springside\\examples\\showcase\\src\\main\\java\\org\\springside\\examples\\showcase\\ws\\server\\result\\LargeImageResult.java, MTOM Streaming DataHandler author calvin LargeImageResult WSResult serialVersionUID imageData getImageData Optional  return empty setImageData this name namespace WsConstants NS application octet stream
E:\\nuaa\\1st_Year\\1_code\\LocalGit\\springside\\examples\\showcase\\src\\main\\java\\org\\springside\\examples\\showcase\\ws\\server\\result\\SmallImageResult.java, Base  Binary byte author calvin SmallImageResult WSResult serialVersionUID imageData getImageData Optional return empty setImageData this name namespace WsConstants NS
E:\\nuaa\\1st_Year\\1_code\\LocalGit\\springside\\examples\\showcase\\src\\main\\java\\org\\springside\\examples\\showcase\\ws\\server\\result\\WSResult.java, WebService author calvin  xx WSResult SUCCESS PARAMETER ERROR IMAGE SYSTEM MESSAGE code message buildResult resultClass resultCode resultMessage Optional try T result newInstance setResult return catch Exception ex throw ReflectionUtils convertReflectionExceptionToUnchecked buildDefaultErrorResult getCode empty setCode this getMessage setMessage name namespace WsConstants NS
E:\\nuaa\\1st_Year\\1_code\\LocalGit\\springside\\examples\\showcase\\src\\main\\java\\org\\springside\\examples\\showcase\\ws\\server\\SmallImageWebService.java, Base  Binary byte author calvin SmallImageWebService getImage Optional empty name SmallImageService targetNamespace WsConstants NS
E:\\nuaa\\1st_Year\\1_code\\LocalGit\\springside\\examples\\showcase\\src\\main\\java\\org\\springside\\examples\\showcase\\ws\\server\\UserWebService.java, JAX WS WebService author calvin SpringSecurity UserWebService getAllUser Optional empty getUser id  name UserService targetNamespace WsConstants NS WebParam
E:\\nuaa\\1st_Year\\1_code\\LocalGit\\springside\\examples\\showcase\\src\\main\\java\\org\\springside\\examples\\showcase\\ws\\server\\WsConstants.java, WebService author calvin NameSpace WsConstants NS
E:\\nuaa\\1st_Year\\1_code\\LocalGit\\springside\\examples\\showcase\\src\\main\\java\\org\\springside\\examples\\showcase\\xml\\HouseMapAdapter.java, Map String houses xml Adapter HouseMapAdapter List HouseEntry Wrapper HouseMap MapEntry house key bj item hosue gz author calvin Entry XmlAdapter entries value marshal map Optional  houseMap new for e entrySet add return empty unmarshal Maps newLinkedHashMap put getKey getValue name
