E:\\nuaa\\1st_Year\\1_code\\LocalGit\\itracker\\itracker-web\\src\\main\\java\\org\\itracker\\web\\actions\\project\\RemoveHistoryEntryAction.java, RemoveHistoryEntryAction ItrackerBaseAction log execute mapping form request response Optional  ActionMessages errors new try IssueService issueService ServletContextUtils getItrackerServices getIssueService Integer historyId PropertyUtils getSimpleProperty String caller if null HttpSession session getSession true User currUser getAttribute Constants USER KEY isSuperUser return findForward unauthorized else issueId removeIssueHistoryEntry getId ActionForward editissue getPath id catch Exception e add GLOBAL MESSAGE ActionMessage itracker web error system System Error isEmpty saveErrors empty
E:\\nuaa\\1st_Year\\1_code\\LocalGit\\itracker\\itracker-web\\src\\main\\java\\org\\itracker\\web\\actions\\project\\RemoveIssueAttachmentAction.java, RemoveIssueAttachmentAction ItrackerBaseAction log execute mapping form request response Optional  ActionMessages errors new if LoginUtilities hasPermission UserUtilities PERMISSION USER ADMIN return findForward unauthorized try IssueService issueService ServletContextUtils getItrackerServices getIssueService Integer attachmentId getParameter id null IssueAttachment attachment getIssueAttachment ConfigurationService configurationService getConfigurationService File attachmentFile getProperty dir separator getFileName delete removeIssueAttachment catch NumberFormatException nfe add GLOBAL MESSAGE ActionMessage itracker web error removeattachment isDebugEnabled debug Invalid specified Exception e system isEmpty saveErrors listattachments empty
E:\\nuaa\\1st_Year\\1_code\\LocalGit\\itracker\\itracker-web\\src\\main\\java\\org\\itracker\\web\\actions\\project\\ViewIssueAction.java, Get issue history sort on create date attachments of and created the status name to display severity Create Project field map Set objects in request that are required for ui render ViewIssueAction ItrackerBaseAction log execute mapping form response Optional  IssueService issueService ServletContextUtils getItrackerServices getIssueService ActionMessages errors new Locale locale getLocale String pageTitleKey itracker web viewissue title pageTitleArg getParameter id setAttribute Integer issueId try valueOf catch RuntimeException re add GLOBAL MESSAGE ActionMessage error noissue saveErrors return findForward HttpSession session getSession User um RequestHelper getCurrentUser NotificationService notificationService getNotificationService Issue getIssue Exception ex null if invalidissue info Forward project getProject getStatus Status ACTIVE VIEWABLE projectlocked else LoginUtilities canViewIssue unauthorized IssueForm setupNotificationsInRequest IssueNavigationUtil setupNextPreviousIssueInRequest List IssueHistory issueHistories getHistory histories ArrayList Collections CREATE DATE COMPARATOR IssueUtilities HISTORY STATUS AVAILABLE getVersions Version VERSION getComponents size Component NAME VersionComparator IssueAttachment getAttachments issueStatusName getStatusName issueSeverityName getSeverityName getSeverity setupProjectFieldsMapJspEnv getCustomFields getFields hasAttachmentOption ProjectUtilities hasOption OPTION NO ATTACHMENTS getOptions rssFeed servlets issues p getId i hasIssueNotification getRemoteUser hasHardIssueNotification hasHardNotification canEditIssue canCreateIssue hasPermission PermissionType ISSUE issueOwnerName getOwner ITrackerResources getString generic unassigned getFirstName getLastName empty
E:\\nuaa\\1st_Year\\1_code\\LocalGit\\itracker\\itracker-web\\src\\main\\java\\org\\itracker\\web\\actions\\project\\ViewIssueActivityAction.java, author ranks executes this struts actions processing check if user can view the issue activites for requested return ActionForward not null access is denied granted to see activities read id from request Integer or in Set objects that are required ui render param issueService ViewIssueActivityAction ItrackerBaseAction log execute mapping form response Optional  isDebugEnabled debug called IssueService ServletContextUtils getItrackerServices getIssueService ret checkPermission has no permission forwarding Map IssueActivity String prepareActivitiesMap preparing with setupJspEnv findForward viewissueactivity final PermissionType permissions RequestHelper getUserPermissions getSession User getCurrentUser issueId getIssueId Project project getIssueProject owner getIssueOwner creator getIssueCreator UserUtilities hasPermission getId ISSUE VIEW ALL USERS equals unauthorized try valueOf getParameter catch RuntimeException re caught setAttribute SortedMap new TreeMap AbstractEntity ID COMPARATOR Iterator activityIt getIssueActivity iterator issueActivity while hasNext next put IssueUtilities getActivityName getActivityType LoginUtilities getCurrentLocale
E:\\nuaa\\1st_Year\\1_code\\LocalGit\\itracker\\itracker-web\\src\\main\\java\\org\\itracker\\web\\actions\\project\\WatchIssueAction.java, index was the old name for portalhome we have to clean naming in this area WatchIssueAction ItrackerBaseAction log execute mapping form request response Optional  ActionMessages errors new try IssueService issueService ServletContextUtils getItrackerServices getIssueService NotificationService notificationService getNotificationService Integer issueId getParameter id null Issue issue getIssue Project project getIssueProject if return findForward unauthorized HttpSession session getSession true User currUser getAttribute Constants USER KEY Map Set PermissionType userPermissions RequestHelper getUserPermissions UserUtilities hasPermission getId PERMISSION VIEW ALL Notification notification boolean userHasIssueNotification false List notifications getNotifications Iterator nIterator iterator hasNext next getUser equals getRole Role IP remove break setNotifications removeIssueNotification else setUser setIssue setRole addIssueNotification String caller editissue ActionForward getPath viewissue listissues projectId catch Exception e add GLOBAL MESSAGE ActionMessage itracker web error login system System Error isEmpty saveErrors empty
E:\\nuaa\\1st_Year\\1_code\\LocalGit\\itracker\\itracker-web\\src\\main\\java\\org\\itracker\\web\\actions\\report\\DisplayReportAction.java, Export all of the issues in system This wasn t a regular search So instead take selected projects and find for them check which ones user can see then create new array must be look query result loaded with current session lazy loading hack we have to more structured way support various types queries DisplayReportAction ItrackerBaseAction log execute mapping form request response Optional  ActionMessages errors try HttpSession getSession false Locale userLocale LoginUtilities getCurrentLocale List Issue reportingIssues ArrayList String reportType PropertyUtils getSimpleProperty type info report was final Integer projectIds IssueService issueService ServletContextUtils getItrackerServices getIssueService ConfigurationService configurationService getConfigurationService ReportService reportService getReportService if equalsIgnoreCase User currUser getAttribute Constants USER KEY isSuperUser add GLOBAL MESSAGE ActionMessage itracker web error unauthorized throw ReportException getAllIssues Collections sort ID COMPARATOR else project null length reportDataList projectId getIssuesByProjectId issue canViewIssue projectrequired IssueSearchQuery isqm SEARCH QUERY getResults getIssue getId debug Report data contains size elements isEmpty noreportdata reportId reportOutput Invalid id requested invalidreport ReportUtilities REPORT EXPORT XML intValue export SystemConfiguration config getSystemConfiguration ImportExportTags LOCALE ImportExportUtilities exportIssues return Defined reportModel getReportDAO findByPrimaryKey found Project Processing outputReport catch re Error StringUtils getErrorKey details getMessage Exception e warn processing saveErrors findForward empty generateReport parameters datasource JasperReport jasperReport JasperCompileManager compileReport ByteArrayInputStream getFileData JasperPrint jasperPrint JasperFillManager fillReport JRException reportDataArray JRBeanCollectionDataSource beanCollectionDataSource Map Object HashMap reportTitle getName getNameKey ITrackerResources getString put ReportTitle BaseDir File RESOURCE BUNDLE ITrackerResourceBundle getBundle ServletOutputStream out getOutputStream JRExporter x OUTPUT PDF equals setHeader Content Type application pdf Disposition attachment filename SimpleDateFormat yyyy MM dd format Date JRPdfExporter XLS xls JRXlsExporter CSV text csv JRCsvExporter HTML html JRHtmlExporter output invalidreportoutput setParameter JRExporterParameter JASPER PRINT STREAM exportReport flush close IOException
E:\\nuaa\\1st_Year\\1_code\\LocalGit\\itracker\\itracker-web\\src\\main\\java\\org\\itracker\\web\\actions\\report\\ListReportsAction.java, ListReportsAction ItrackerBaseAction execute mapping form request response Optional  IssueService issueService ServletContextUtils getItrackerServices getIssueService ProjectService projectService getProjectService ReportService reportService getReportService setAttribute ih ph rh String pageTitleKey itracker web listreports title pageTitleArg return findForward list reports empty super
E:\\nuaa\\1st_Year\\1_code\\LocalGit\\itracker\\itracker-web\\src\\main\\java\\org\\itracker\\web\\actions\\ShowHelpAction.java, This method will prepare the request attribute for help about jsp ShowHelpAction ItrackerBaseAction log execute mapping form response Optional  String helpPage helpParam getParameter page HttpSession session getSession true Locale locale getAttribute Constants LOCALE KEY debug Requesting Help Page if ct equals commontasks else ab setupHelpAboutPageAttributes index Redirecting to setAttribute ITrackerResources getString itracker web helppage pageTitleKey showhelp title pageTitleArg return findForward show empty ConfigurationService configurationService ServletContextUtils getItrackerServices getConfigurationService long startTimeMillis Long parseLong getProperty start time millis SimpleDateFormat dateFormat new dateformat full startTime format Date starttime javaVersion System java version javaVendor vendor super
E:\\nuaa\\1st_Year\\1_code\\LocalGit\\itracker\\itracker-web\\src\\main\\java\\org\\itracker\\web\\actions\\UnauthorizedAction.java, UnauthorizedAction ItrackerBaseAction UNAUTHORIZED execute mapping form request response Optional  ActionErrors messages new add ActionMessages GLOBAL MESSAGE ActionMessage itracker web error unauthorized saveErrors return findForward empty
E:\\nuaa\\1st_Year\\1_code\\LocalGit\\itracker\\itracker-web\\src\\main\\java\\org\\itracker\\web\\actions\\user\\ForgotPasswordAction.java, ForgotPasswordAction ItrackerBaseAction log execute mapping form request response Optional  ActionMessages errors new try ConfigurationService configurationService ServletContextUtils getItrackerServices getConfigurationService UserService userService getUserService if getBooleanProperty allow forgot password true throw PasswordException FEATURE DISABLED String login PropertyUtils getSimpleProperty lastName null equals User user Locale locale getUserByLogin UNKNOWN USER ITrackerResources getLocale getPreferences getUserLocale catch RuntimeException e getLastName equalsIgnoreCase INVALID NAME getEmail EMAIL getStatus UserUtilities STATUS ACTIVE INACTIVE ACCOUNT isDebugEnabled debug ForgotPasswordHandler found matching getFirstName getLogin subject getString itracker email forgotpass StringBuffer msgText append body newPass generateUserPassword updateUser web attr getEmailService sendEmail toString pe Password Exception for Type getType add GLOBAL MESSAGE ActionMessage error lastname else invalidemail inactive unknown notenabled Forgot function has been disabled system Error during retrieval isEmpty saveErrors return findForward forgotpassword message success empty
E:\\nuaa\\1st_Year\\1_code\\LocalGit\\itracker\\itracker-web\\src\\main\\java\\org\\itracker\\web\\actions\\user\\ForgotPasswordFormAction.java, ForgotPasswordFormAction ItrackerBaseAction log execute mapping form request response Optional  ActionMessages errors new try ForgotPasswordForm forgotPasswordForm if null isEmpty setAttribute saveToken return getInputForward catch Exception e error while creating forgot password add GLOBAL MESSAGE ActionMessage itracker web system saveErrors findForward empty
E:\\nuaa\\1st_Year\\1_code\\LocalGit\\itracker\\itracker-web\\src\\main\\java\\org\\itracker\\web\\actions\\user\\LoginAction.java, LoginAction ItrackerBaseAction log execute mapping form request response Optional  debug called String pageTitleKey itracker web login title pageTitleArg setAttribute saveErrors new ActionMessages return getInputForward empty
E:\\nuaa\\1st_Year\\1_code\\LocalGit\\itracker\\itracker-web\\src\\main\\java\\org\\itracker\\web\\actions\\user\\LogoffAction.java, nothing to do LogoffAction ItrackerBaseAction execute mapping form request response Optional  return null empty
E:\\nuaa\\1st_Year\\1_code\\LocalGit\\itracker\\itracker-web\\src\\main\\java\\org\\itracker\\web\\actions\\user\\SelfRegisterAction.java, TODO remove this hack should be handled central there are other instances of SelfRegisterAction ItrackerBaseAction log execute mapping form request response Optional  ActionMessages errors new resetToken try ConfigurationService configurationService ServletContextUtils getItrackerServices getConfigurationService boolean allowSelfRegister getBooleanProperty allow self register false if add GLOBAL MESSAGE ActionMessage itracker web error notenabled else UserForm regForm User user getLogin UserUtilities encryptPassword getPassword getFirstName getLastName getEmail REGISTRATION TYPE SELF hasRequiredData missingfields UserService userService getUserService allowRegistration AuthenticationConstants AUTH PASSWORD PLAIN REQ SOURCE WEB createUser UserPreferences userPrefs getPreferences null setPreferences setUser setUserLocale String valueOf LoginUtilities getCurrentLocale Notification notification setRole Role ANY getITrackerServices getNotificationService sendNotification Type REGISTER getBaseURL unauthorized catch UserException ue existinglogin Exception e info Error during registration getMessage system isEmpty saveErrors saveToken return getInputForward findForward arrivalforward empty
E:\\nuaa\\1st_Year\\1_code\\LocalGit\\itracker\\itracker-web\\src\\main\\java\\org\\itracker\\web\\actions\\user\\SelfRegisterFormAction.java, itracker web selfreg title String pageTitleKey pageTitleArg request setAttribute SelfRegisterFormAction ItrackerBaseAction execute mapping form response Optional  saveToken return getInputForward empty
E:\\nuaa\\1st_Year\\1_code\\LocalGit\\itracker\\itracker-web\\src\\main\\java\\org\\itracker\\web\\ApplicationInitialization.java, This gets started when the Spring application context starts up check for and create admin user if so configured Check we should do it ApplicationInitialization logger userService configurationService servletConfig init Optional  try ITrackerResources setConfigurationService info Checking initializing languages in database initializeAllLanguages false default system configuration initializeConfiguration Setting cached entries resetConfigurationCache createAdminUser setUpPdfFonts catch PasswordException pe Unable to Error getMessage UserException ue warn Exception while creating empty StringTokenizer st new getProperty pdf export fonts arial String font hasMoreTokens StringUtils trim nextToken DefaultJasperReportsContext getInstance setProperty net sf jasperreports this getClass getResource ttf toString boolean createAdmin getBooleanProperty super Create option set true existing getUserByLogin NoSuchEntityException e debug Attempting User adminUser UserUtilities encryptPassword Super createUser setServletConfig reportService Logger getLogger
E:\\nuaa\\1st_Year\\1_code\\LocalGit\\itracker\\itracker-web\\src\\main\\java\\org\\itracker\\web\\exceptions\\ByteLimitExceededException.java, ByteLimitExceededException IOException serialVersionUID Optional empty message  super
E:\\nuaa\\1st_Year\\1_code\\LocalGit\\itracker\\itracker-web\\src\\main\\java\\org\\itracker\\web\\filters\\ExecuteAlwaysFilter.java, author ranks Logger for ExecuteAlwaysFilter From IrackerBaseAction executeAlways logout and go to login p Save the specified error messages keys into appropriate request attribute use by lt html errors gt tag if any are required Otherwise ensure that is not created param The servlet we processing Error object since Struts Remove none need TODO this should be configured per instance Request server name only used exception logged configuration found remove deprecated currLocale necessary anymore default header jsp log iTrackerServices destroy Optional empty doFilter servletRequest response chain  instanceof HttpServletRequest RuntimeException re new IllegalArgumentException Unsupported of type getClass getName failed invalid throw String path getRequestURI substring getContextPath length isDebugEnabled debug called with setting common attributes coming from former setupCommonReqAttributes ServletContextUtils getItrackerServices getConfigurationService SessionManager getSessionNeedsReset getRemoteUser getSession invalidate HttpServletResponse sendRedirect setupCommonReqAttributesEx try executing completed execution catch e execute runtime getMessage handleError IOException ioe i o ServletException se err caught fatal filter null throwable getSimpleName unknown httpRequest httpResponse ActionMessages add GLOBAL MESSAGE ActionMessage itracker web system message Object getLocalizedMessage getCanonicalName saveErrors do redirect page isEmpty removeAttribute Globals ERROR KEY return saved setAttribute configurationService boolean allowForgotPassword allowSelfRegister allowSaveLogin siteTitle siteLogo getBooleanProperty allow forgot password true self register false save getProperty site title org logo Locale locale LoginUtilities getCurrentLocale baseURL getSystemBaseURL getScheme getServerName getServerPort warn base url locales getAvailableLanguages Constants LOCALE contextPath currentDate java util Date currentVersion version Unknown final Map Integer Set PermissionType permissions RequestHelper getUserPermissions hasPermissionUserAdmin UserUtilities hasPermission USER ADMIN hasPermissionProductAdmin PRODUCT hasPermissionViewAll ISSUE VIEW ALL init filterConfig getITrackerServices
E:\\nuaa\\1st_Year\\1_code\\LocalGit\\itracker\\itracker-web\\src\\main\\java\\org\\itracker\\web\\filters\\package-info.java,
E:\\nuaa\\1st_Year\\1_code\\LocalGit\\itracker\\itracker-web\\src\\main\\java\\org\\itracker\\web\\filters\\SetRequestCharacterEncoding.java, This class will set the chracter encoding of each request that uses filter It use specifried in init parameter or if is not present fall back to a default value UTF Set character param current ServletRequest object response ServletResponse filterChain FilterChain throws IOException any io error occurs ServletException other servlet Initialize filterConfig configuration Returns Sets Reset settings SetRequestCharacterEncoding DEFAULT ENCODING doFilter Optional  setCharacterEncoding getEncoding this setEncoding getInitParameter return null destroy getFilterConfig empty setFilterConfig
E:\\nuaa\\1st_Year\\1_code\\LocalGit\\itracker\\itracker-web\\src\\main\\java\\org\\itracker\\web\\forms\\AdminActionForm.java, This is the LoginForm Struts Form It used by Login form author ready AdminActionForm ValidatorForm serialVersionUID importFile optionreuseusers optionreuseprojects optionreuseconfig optionreusefields optioncreatepasswords reset mapping request Optional  null empty validate ActionErrors errors super return getImportFile setImportFile this getOptioncreatepasswords setOptioncreatepasswords getOptionreuseconfig setOptionreuseconfig getOptionreusefields setOptionreusefields getOptionreuseprojects setOptionreuseprojects getOptionreuseusers setOptionreuseusers
E:\\nuaa\\1st_Year\\1_code\\LocalGit\\itracker\\itracker-web\\src\\main\\java\\org\\itracker\\web\\forms\\AssignIssueForm.java, This is the LoginForm Struts Form It used by Login form author ready AssignIssueForm ValidatorForm serialVersionUID issueId projectId userId reset mapping request Optional  null empty validate ActionErrors errors super return getIssueId setIssueId this getProjectId setProjectId getUserId setUserId
E:\\nuaa\\1st_Year\\1_code\\LocalGit\\itracker\\itracker-web\\src\\main\\java\\org\\itracker\\web\\forms\\ComponentForm.java, This is the LoginForm Struts Form It used by Login form author ready ComponentForm ValidatorForm serialVersionUID action id projectId name description status reset mapping request Optional  null empty validate ActionErrors errors super return getAction setAction this getDescription setDescription getId setId getName setName getProjectId setProjectId getStatus setStatus
E:\\nuaa\\1st_Year\\1_code\\LocalGit\\itracker\\itracker-web\\src\\main\\java\\org\\itracker\\web\\forms\\ConfigurationForm.java, This is the LoginForm Struts Form It used by Login form author ready let s try to put String here public void reset ActionMapping mapping HttpServletRequest request action null id value order key translations ConfigurationForm ValidatorForm serialVersionUID typeKey languages validate Optional  ActionErrors errors super return getAction empty setAction this getId setId getKey setKey getTypeKey setTypeKey getOrder setOrder getTranslations setTranslations getValue setValue setLanguages getLanguages
E:\\nuaa\\1st_Year\\1_code\\LocalGit\\itracker\\itracker-web\\src\\main\\java\\org\\itracker\\web\\forms\\CustomFieldForm.java, This is the Struts Form It used by action author ready private String base locale public void reset ActionMapping mapping HttpServletRequest request null id fieldType required dateFormat sortOptionsByName value translations get localization in CustomFieldForm ValidatorForm log setRequestEnv Optional  ConfigurationService configurationService ServletContextUtils getItrackerServices getConfigurationService Locale currentLocale LoginUtilities getCurrentLocale CustomField customField getSession getAttribute Constants CUSTOMFIELD KEY Map List languages map getAvailableLanguages languagesArray new size int idx for language keySet pageTitleKey itracker web admin editcustomfield title create pageTitleArg getAction if update equals ITrackerResources getString CustomFieldUtilities getCustomFieldLabelKey getId setAttribute customFieldForm this NameValuePair languagesNameValuePair TreeMap COMPARATOR Entry entry entrySet getKey locales getValue localesNameValuePair ArrayList localeNameValuePair name add languageNameValuePair put HttpSession session baseLocaleKey BASE LOCALE CustomFieldValue options getOptions Collections sort SORT ORDER isDebugEnabled debug sorted values order comparator Integer optionsMap option optionName getCustomFieldOptionName fieldTypeString toString Type STRING getCode fieldTypeInteger INTEGER fieldTypeDate DATE fieldTypeList LIST dateFormatDateOnly FORMAT DATEONLY dateFormatTimeOnly TIMEONLY dateFormatFull FULL CustomFieldType field empty validate ActionErrors errors super getBaseTranslation trim ActionMessages GLOBAL MESSAGE ActionMessage error attr baselocale return setAction getDateFormat setDateFormat getFieldType setFieldType setId getRequired setRequired getSortOptionsByName setSortOptionsByName getTranslations setTranslations setValue serial
E:\\nuaa\\1st_Year\\1_code\\LocalGit\\itracker\\itracker-web\\src\\main\\java\\org\\itracker\\web\\forms\\CustomFieldValueForm.java, This is the LoginForm Struts Form It used by Login form author ready let s try to put String here get localization in base locale TODO setup request env for validation output CustomFieldValueForm ValidatorForm serialVersionUID action id value sortOrder translations getAction Optional  return empty setAction this getId setId getTranslations setTranslations getBaseTranslation ITrackerResources BASE LOCALE getValue setValue reset mapping setSortOrder getSortOrder validate ActionErrors errors super if null equals trim add ActionMessages GLOBAL MESSAGE new ActionMessage itracker web error required getString attr baselocale LoginUtilities getCurrentLocale
E:\\nuaa\\1st_Year\\1_code\\LocalGit\\itracker\\itracker-web\\src\\main\\java\\org\\itracker\\web\\forms\\DisplayReportForm.java, This is the LoginForm Struts Form It used by Login form author ready DisplayReportForm ValidatorForm serialVersionUID type projectIds reportId reportOutput reset mapping request Optional  null empty validate ActionErrors errors super return getProjectIds if clone setProjectIds this else getReportId setReportId getReportOutput setReportOutput getType setType
E:\\nuaa\\1st_Year\\1_code\\LocalGit\\itracker\\itracker-web\\src\\main\\java\\org\\itracker\\web\\forms\\ForgotPasswordForm.java, This is the LoginForm Struts Form It used by Login form author ready ForgotPasswordForm ValidatorForm serialVersionUID login lastName reset mapping request Optional  null String pageTitleKey itracker web forgotpass title pageTitleArg setAttribute empty validate ActionErrors errors super return getLastName setLastName this getLogin setLogin
E:\\nuaa\\1st_Year\\1_code\\LocalGit\\itracker\\itracker-web\\src\\main\\java\\org\\itracker\\web\\forms\\ImportForm.java, This is the LoginForm Struts Form It used by Login form author ready ImportForm ValidatorForm serialVersionUID importFile optionreuseusers optionreuseprojects optionreuseconfig optionreusefields optioncreatepasswords reset mapping request Optional  null empty validate ActionErrors errors super return getImportFile setImportFile this getOptioncreatepasswords setOptioncreatepasswords getOptionreuseconfig setOptionreuseconfig getOptionreusefields setOptionreusefields getOptionreuseprojects setOptionreuseprojects getOptionreuseusers setOptionreuseusers
