E:\nuaa\1st_Year\1_code\LocalGit\mall\.idea\compiler.xml,CompilerConfiguration Maven default annotation processors profile true target generated sources annotations test mall security search admin mbg demo common portal JavacSettings ADDITIONAL OPTIONS OVERRIDE parameters
E:\nuaa\1st_Year\1_code\LocalGit\mall\.idea\encodings.xml,Encoding file PROJECT DIR UTF mall admin src main java common demo mbg portal search security resources
E:\nuaa\1st_Year\1_code\LocalGit\mall\.idea\jarRepositories.xml,RemoteRepositoriesConfiguration id central name Central Repository url http maven aliyun com nexus content groups public Maven repository https repo org jboss community JBoss Community repositories
E:\nuaa\1st_Year\1_code\LocalGit\mall\.idea\misc.xml,ExternalStorageConfigurationManager true MavenProjectsManager originalFiles PROJECT DIR pom xml ProjectRootManager JDK JavaSDK file out
E:\nuaa\1st_Year\1_code\LocalGit\mall\.idea\vcs.xml,VcsDirectoryMappings Git
E:\nuaa\1st_Year\1_code\LocalGit\mall\.idea\workspace.xml,continueSignPoint expiration commentGenerator record test continueSignDay item orderId WHEN THEN deliverySn AutoImportSettings autoReloadType SELECTIVE ChangeListManager true ca b f bebad Default Changelist PROJECT DIR mall mbg src main resources com macro mapper PmsProductMapper xml false SHOW DIALOG HIGHLIGHT CONFLICTS NON ACTIVE CHANGELIST LAST RESOLUTION IGNORE DefaultGradleProjectSettings isMigrated FindInProjectRecents Git Settings RECENT GIT ROOT PATH IdeDocumentHistory CHANGED PATHS java UmsMemberRuleSettingMapper admin dao OmsOrderDao MarkdownSettingsMigration stateVersion MavenImportPreferences generalSettings mavenHome D apache maven userSettingsFile conf settings importingSettings jdkForImporter vmOptionsForImporter Xmxm ProjectFrameBounds x y width height ProjectId BsoFziJLzVucbrafKvaiiTqAkz ProjectView ProjectViewState hideEmptyMiddlePackages showLibraryContents PropertiesComponent SHARE CONFIGURATION FILES WebServerToolWindowFactoryState aspect path notification shown nodejs interpreter stuck in default project undefined npm reset for structure last edited Modules proportion side editor selected configurable preferences pluginManager RunManager Spring Boot MallPortalApplication MallAdminApplication SpringBootApplicationConfigurationType SPRING BOOT MAIN CLASS Make MallDemoApplication demo portal MallSearchApplication search SpellCheckerSettings application level SvnConfiguration TaskManager task number presentableId TimeTrackingManager totallyTimeSpent ToolWindowManager combo Project Structure Web Designer Favorites bottom Message Find Run Debug Cvs Inspection TODO Docker Version Control Database Changes Log Analyzer Terminal Event SOQL Query Java Enterprise Anonymous Apex right Commander SLIDING Ant Build Hierarchy Maven Bean Validation Palette TypeScriptGeneratedFilesManager version editorHistoryManager file dto OmsOrderDetail text OmsOrderReturnApplyDao OmsOrderReturnApplyMapper yml model UmsMemberRuleSetting security util JwtTokenUtil service impl OssServiceImpl CommentGenerator generatorConfig PmsAlbumMapper PmsProductAttributeValueDao PmsSkuStockDao PmsMemberPriceDao PmsProductFullReductionDao PortalOrderItemDao PortalOrderDao OmsOrderOperateHistoryDao masterDetails ProjectJDKs UI proportions
E:\nuaa\1st_Year\1_code\LocalGit\mall\mall-admin\pom.xml,com macro mall admin SNAPSHOT jar project for mbg security aliyun oss sdk io minio org springframework boot spring maven plugin spotify docker http apache POM www w XMLSchema instance v xsd
E:\nuaa\1st_Year\1_code\LocalGit\mall\mall-admin\src\main\resources\dao\CmsPrefrenceAreaProductRelationDao.xml,insert into cms prefrence area product relation id values item prefrenceAreaId jdbcType BIGINT productId com macro mall dao CmsPrefrenceAreaProductRelationDao insertList list index
E:\nuaa\1st_Year\1_code\LocalGit\mall\mall-admin\src\main\resources\dao\CmsSubjectProductRelationDao.xml,insert into cms subject product relation id values item subjectId jdbcType BIGINT productId com macro mall dao CmsSubjectProductRelationDao insertList list index
E:\nuaa\1st_Year\1_code\LocalGit\mall\mall-admin\src\main\resources\dao\OmsOrderDao.xml,SELECT FROM oms order WHERE delete status AND sn queryParam orderSn source type sourceType orderType create time LIKE concat createTime receiver name receiverKeyword OR phone UPDATE SET delivery CASE id WHEN item orderId THEN deliverySn END company deliveryCompany now IN o oi product pic brand price quantity attr oh history operate man note LEFT JOIN ON ORDER BY ASC DESC com macro mall dao OmsOrderDao orderDetailResultMap dto OmsOrderDetail mapper OmsOrderMapper BaseResultMap orderItemList OmsOrderItemMapper historyList OmsOrderOperateHistoryMapper getList null and list getDetail
E:\nuaa\1st_Year\1_code\LocalGit\mall\mall-admin\src\main\resources\dao\OmsOrderOperateHistoryDao.xml,INSERT INTO oms order operate history id man create time status note VALUES item orderId operateMan createTime jdbcType TIMESTAMP orderStatus com macro mall dao OmsOrderOperateHistoryDao insertList list index
E:\nuaa\1st_Year\1_code\LocalGit\mall\mall-admin\src\main\resources\dao\OmsOrderReturnApplyDao.xml,SELECT id create time member username product real price count return name status handle FROM oms order apply WHERE AND queryParam man handleMan LIKE CONCAT createTime handleTime concat receiverKeyword OR phone ra ca address province city region detail LEFT JOIN company ON com macro mall dao OmsOrderReturnApplyDao returnApplyDetailResultMap dto OmsOrderReturnApplyResult mapper OmsOrderReturnApplyMapper BaseResultMap companyAddress OmsCompanyAddressMapper getList null and getDetail
E:\nuaa\1st_Year\1_code\LocalGit\mall\mall-admin\src\main\resources\dao\PmsMemberPriceDao.xml,INSERT INTO pms member price product id level name VALUES item productId jdbcType BIGINT memberLevelId memberPrice DECIMAL memberLevelName VARCHAR com macro mall dao PmsMemberPriceDao insertList list index
E:\nuaa\1st_Year\1_code\LocalGit\mall\mall-admin\src\main\resources\dao\PmsProductAttributeCategoryDao.xml,SELECT pac id name pa attr FROM pms product attribute category LEFT JOIN ON AND type com macro mall dao PmsProductAttributeCategoryDao getListWithAttrMap dto PmsProductAttributeCategoryItem mapper PmsProductAttributeCategoryMapper BaseResultMap productAttributeList PmsProductAttributeMapper getListWithAttr
E:\nuaa\1st_Year\1_code\LocalGit\mall\mall-admin\src\main\resources\dao\PmsProductAttributeDao.xml,SELECT pa id attributeId pac attributeCategoryId FROM pms product category attribute relation pcar LEFT JOIN ON WHERE com macro mall dao PmsProductAttributeDao getProductAttrInfo dto ProductAttrInfo
E:\nuaa\1st_Year\1_code\LocalGit\mall\mall-admin\src\main\resources\dao\PmsProductAttributeValueDao.xml,insert into pms product attribute value id values item productId jdbcType BIGINT productAttributeId VARCHAR com macro mall dao PmsProductAttributeValueDao insertList list index
E:\nuaa\1st_Year\1_code\LocalGit\mall\mall-admin\src\main\resources\dao\PmsProductCategoryAttributeRelationDao.xml,INSERT INTO pms product category attribute relation id VALUES item productCategoryId jdbcType BIGINT productAttributeId com macro mall dao PmsProductCategoryAttributeRelationDao insertList list index
E:\nuaa\1st_Year\1_code\LocalGit\mall\mall-admin\src\main\resources\dao\PmsProductCategoryDao.xml,select c id name child from pms product category left join on parent where com macro mall dao PmsProductCategoryDao listWithChildrenMap dto PmsProductCategoryWithChildrenItem mapper PmsProductCategoryMapper BaseResultMap children listWithChildren
E:\nuaa\1st_Year\1_code\LocalGit\mall\mall-admin\src\main\resources\dao\PmsProductDao.xml,SELECT pc parent id cateParentId l ladder product discount count price pf full reduce m member level name s sku low stock pic sale code sp data a attribute value FROM pms p LEFT JOIN category on ON reduction WHERE select from cms subject relation where productId prefrence area com macro mall dao PmsProductDao updateInfoMap dto PmsProductResult mapper PmsProductMapper ResultMapWithBLOBs BIGINT productLadderList PmsProductLadderMapper BaseResultMap productFullReductionList PmsProductFullReductionMapper memberPriceList PmsMemberPriceMapper skuStockList PmsSkuStockMapper productAttributeValueList PmsProductAttributeValueMapper subjectProductRelationList selectSubjectProductRelationByProductId prefrenceAreaProductRelationList selectPrefrenceAreaProductRelationByProductId getUpdateInfo CmsSubjectProductRelationMapper CmsPrefrenceAreaProductRelationMapper
E:\nuaa\1st_Year\1_code\LocalGit\mall\mall-admin\src\main\resources\dao\PmsProductFullReductionDao.xml,INSERT INTO pms product full reduction id price reduce VALUES item productId jdbcType BIGINT fullPrice DECIMAL reducePrice com macro mall dao PmsProductFullReductionDao insertList list index
E:\nuaa\1st_Year\1_code\LocalGit\mall\mall-admin\src\main\resources\dao\PmsProductLadderDao.xml,INSERT INTO pms product ladder id count discount price VALUES item productId jdbcType BIGINT INTEGER DECIMAL com macro mall dao PmsProductLadderDao insertList list index
E:\nuaa\1st_Year\1_code\LocalGit\mall\mall-admin\src\main\resources\dao\PmsProductVertifyRecordDao.xml,insert into pms product vertify record id create time man status detail values item productId jdbcType BIGINT createTime TIMESTAMP vertifyMan VARCHAR INTEGER com macro mall dao PmsProductVertifyRecordDao insertList list index
E:\nuaa\1st_Year\1_code\LocalGit\mall\mall-admin\src\main\resources\dao\PmsSkuStockDao.xml,INSERT INTO pms sku stock product id code price low pic sale sp data VALUES item productId jdbcType BIGINT skuCode VARCHAR DECIMAL INTEGER lowStock spData REPLACE com macro mall dao PmsSkuStockDao insertList list index replaceList
E:\nuaa\1st_Year\1_code\LocalGit\mall\mall-admin\src\main\resources\dao\SmsCouponDao.xml,SELECT c cpr id product name sn cpcr category parent FROM sms coupon LEFT JOIN relation ON WHERE com macro mall dao SmsCouponDao couponItemParam dto SmsCouponParam mapper SmsCouponMapper BaseResultMap productRelationList SmsCouponProductRelationMapper productCategoryRelationList SmsCouponProductCategoryRelationMapper getItem
E:\nuaa\1st_Year\1_code\LocalGit\mall\mall-admin\src\main\resources\dao\SmsCouponProductCategoryRelationDao.xml,INSERT INTO sms coupon product category relation id name parent VALUES item productCategoryId jdbcType BIGINT productCategoryName VARCHAR parentCategoryName couponId com macro mall dao SmsCouponProductCategoryRelationDao insertList list index
E:\nuaa\1st_Year\1_code\LocalGit\mall\mall-admin\src\main\resources\dao\SmsCouponProductRelationDao.xml,INSERT INTO sms coupon product relation id name sn VALUES item productId jdbcType BIGINT productName VARCHAR productSn couponId INTEGER com macro mall dao SmsCouponProductRelationDao insertList list index
E:\nuaa\1st_Year\1_code\LocalGit\mall\mall-admin\src\main\resources\dao\SmsFlashPromotionProductRelationDao.xml,SELECT r id flash promotion price count limit session product sort p name sn stock FROM sms relation LEFT JOIN pms ON WHERE flashPromotionId AND flashPromotionSessionId ORDER BY DESC com macro mall dao SmsFlashPromotionProductRelationDao flashProductMap dto SmsFlashPromotionProduct mapper SmsFlashPromotionProductRelationMapper BaseResultMap PmsProductMapper getList
E:\nuaa\1st_Year\1_code\LocalGit\mall\mall-admin\src\main\resources\dao\UmsAdminRoleRelationDao.xml,INSERT INTO ums admin role relation id VALUES item adminId jdbcType BIGINT roleId select r from ar left join on where SELECT ur create time createTime name url description category categoryId FROM LEFT JOIN ON resource rrr WHERE AND IS NOT NULL GROUP BY DISTINCT rr resourceId com macro mall dao UmsAdminRoleRelationDao insertList list index getRoleList mapper UmsRoleMapper BaseResultMap getResourceList model UmsResource getAdminIdList java lang Long
E:\nuaa\1st_Year\1_code\LocalGit\mall\mall-admin\src\main\resources\dao\UmsRoleDao.xml,SELECT m id parent parentId create time createTime title level sort name icon hidden FROM ums admin role relation arr LEFT JOIN r ON menu rmr WHERE adminId AND IS NOT NULL GROUP BY roleId url description category categoryId resource rrr com macro mall dao UmsRoleDao getMenuList model UmsMenu getMenuListByRoleId getResourceListByRoleId UmsResource
E:\nuaa\1st_Year\1_code\LocalGit\mall\mall-common\pom.xml,com macro mall common SNAPSHOT jar project for github pagehelper org springframework boot spring starter web data redis commons net logstash logback encoder io springfox swagger ui validation http maven apache POM www w XMLSchema instance xsd
E:\nuaa\1st_Year\1_code\LocalGit\mall\mall-common\src\main\resources\logback-spring.xml,DEBUG FILE LOG PATTERN UTF PATH debug APP NAME d yyyy MM dd i log MAX SIZE MB HISTORY ERROR ACCEPT DENY error STASH HOST Asia Shanghai project mall level service pid PID thread class logger message stack trace exception org springframework boot logging logback defaults xml console appender context spring application name springBoot TEMP java io tmpdir tmp logs logstash host localhost ch qos core rolling RollingFileAppender classic filter ThresholdFilter SizeAndTimeBasedRollingPolicy LevelFilter net LogstashTcpSocketAppender encoder LoggingEventCompositeJsonEncoder BUSINESS RECORD slfj INFO springfox swagger hibernate validator CONSOLE com macro common WebLogAspect
E:\nuaa\1st_Year\1_code\LocalGit\mall\mall-demo\pom.xml,com macro mall demo SNAPSHOT jar for mbg org springframework boot spring starter thymeleaf security net logstash logback encoder maven plugin http apache POM www w XMLSchema instance xsd
E:\nuaa\1st_Year\1_code\LocalGit\mall\mall-demo\src\main\resources\logback-spring.xml,localhost org springframework boot logging logback base xml LOGSTASH net logstash appender LogstashTcpSocketAppender UTF encoder LogstashEncoder INFO CONSOLE
E:\nuaa\1st_Year\1_code\LocalGit\mall\mall-mbg\pom.xml,com macro mall mbg SNAPSHOT jar project for common github pagehelper spring boot starter alibaba druid org mybatis generator core mysql connector java http maven apache POM www w XMLSchema instance xsd
E:\nuaa\1st_Year\1_code\LocalGit\mall\mall-mbg\src\main\resources\com\macro\mall\mapper\CmsHelpCategoryMapper.xml,and criterion condition value secondValue listItem id name icon help count show status sort select distinct from cms category order by orderByClause where jdbcType BIGINT delete SELECT LAST INSERT ID insert into values VARCHAR helpCount INTEGER showStatus update record set com macro mall mapper CmsHelpCategoryMapper BaseResultMap model CmsHelpCategory Example Where Clause oredCriteria criteria or valid noValue singleValue betweenValue listValue Update By example Base Column List selectByExample CmsHelpCategoryExample parameter null selectByPrimaryKey java lang Long deleteByPrimaryKey deleteByExample AFTER insertSelective countByExample updateByExampleSelective map updateByExample updateByPrimaryKeySelective updateByPrimaryKey
E:\nuaa\1st_Year\1_code\LocalGit\mall\mall-mbg\src\main\resources\com\macro\mall\mapper\CmsHelpMapper.xml,and criterion condition value secondValue listItem id category icon title show status create time read count content select distinct from cms help order by orderByClause where jdbcType BIGINT delete SELECT LAST INSERT ID insert into values categoryId VARCHAR showStatus INTEGER createTime TIMESTAMP readCount LONGVARCHAR update record set com macro mall mapper CmsHelpMapper BaseResultMap model CmsHelp ResultMapWithBLOBs Example Where Clause oredCriteria criteria or valid noValue singleValue betweenValue listValue Update By example Base Column List Blob selectByExampleWithBLOBs CmsHelpExample parameter null selectByExample selectByPrimaryKey java lang Long deleteByPrimaryKey deleteByExample AFTER insertSelective countByExample updateByExampleSelective map updateByExampleWithBLOBs updateByExample updateByPrimaryKeySelective updateByPrimaryKeyWithBLOBs updateByPrimaryKey
E:\nuaa\1st_Year\1_code\LocalGit\mall\mall-mbg\src\main\resources\com\macro\mall\mapper\CmsMemberReportMapper.xml,and criterion condition value secondValue listItem id report type member name create time object status handle note select distinct from cms order by orderByClause delete SELECT LAST INSERT ID insert into values reportType jdbcType INTEGER reportMemberName VARCHAR createTime TIMESTAMP reportObject reportStatus handleStatus count update record BIGINT set com macro mall mapper CmsMemberReportMapper BaseResultMap model CmsMemberReport Example Where Clause oredCriteria criteria or valid noValue singleValue betweenValue listValue Update By example Base Column List selectByExample CmsMemberReportExample parameter null deleteByExample AFTER java lang Long insertSelective countByExample updateByExampleSelective map updateByExample
E:\nuaa\1st_Year\1_code\LocalGit\mall\mall-mbg\src\main\resources\com\macro\mall\mapper\CmsPrefrenceAreaMapper.xml,and criterion condition value secondValue listItem id name sub title sort show status pic select distinct from cms prefrence area order by orderByClause where jdbcType BIGINT delete SELECT LAST INSERT ID insert into values VARCHAR subTitle INTEGER showStatus VARBINARY count update record set com macro mall mapper CmsPrefrenceAreaMapper BaseResultMap model CmsPrefrenceArea ResultMapWithBLOBs Example Where Clause oredCriteria criteria or valid noValue singleValue betweenValue listValue Update By example Base Column List Blob selectByExampleWithBLOBs CmsPrefrenceAreaExample parameter null selectByExample selectByPrimaryKey java lang Long deleteByPrimaryKey deleteByExample AFTER insertSelective countByExample updateByExampleSelective map updateByExampleWithBLOBs updateByExample updateByPrimaryKeySelective updateByPrimaryKeyWithBLOBs updateByPrimaryKey
E:\nuaa\1st_Year\1_code\LocalGit\mall\mall-mbg\src\main\resources\com\macro\mall\mapper\CmsPrefrenceAreaProductRelationMapper.xml,and criterion condition value secondValue listItem id prefrence area product select distinct from cms relation order by orderByClause where jdbcType BIGINT delete SELECT LAST INSERT ID insert into values prefrenceAreaId productId count update record set com macro mall mapper CmsPrefrenceAreaProductRelationMapper BaseResultMap model CmsPrefrenceAreaProductRelation Example Where Clause oredCriteria criteria or valid noValue singleValue betweenValue listValue Update By example Base Column List selectByExample CmsPrefrenceAreaProductRelationExample parameter null selectByPrimaryKey java lang Long deleteByPrimaryKey deleteByExample AFTER insertSelective countByExample updateByExampleSelective map updateByExample updateByPrimaryKeySelective updateByPrimaryKey
E:\nuaa\1st_Year\1_code\LocalGit\mall\mall-mbg\src\main\resources\com\macro\mall\mapper\CmsSubjectCategoryMapper.xml,and criterion condition value secondValue listItem id name icon subject count show status sort select distinct from cms category order by orderByClause where jdbcType BIGINT delete SELECT LAST INSERT ID insert into values VARCHAR subjectCount INTEGER showStatus update record set com macro mall mapper CmsSubjectCategoryMapper BaseResultMap model CmsSubjectCategory Example Where Clause oredCriteria criteria or valid noValue singleValue betweenValue listValue Update By example Base Column List selectByExample CmsSubjectCategoryExample parameter null selectByPrimaryKey java lang Long deleteByPrimaryKey deleteByExample AFTER insertSelective countByExample updateByExampleSelective map updateByExample updateByPrimaryKeySelective updateByPrimaryKey
E:\nuaa\1st_Year\1_code\LocalGit\mall\mall-mbg\src\main\resources\com\macro\mall\mapper\CmsSubjectCommentMapper.xml,and criterion condition value secondValue listItem id subject member nick name icon content create time show status select distinct from cms comment order by orderByClause where jdbcType BIGINT delete SELECT LAST INSERT ID insert into values subjectId memberNickName VARCHAR memberIcon createTime TIMESTAMP showStatus INTEGER count update record set com macro mall mapper CmsSubjectCommentMapper BaseResultMap model CmsSubjectComment Example Where Clause oredCriteria criteria or valid noValue singleValue betweenValue listValue Update By example Base Column List selectByExample CmsSubjectCommentExample parameter null selectByPrimaryKey java lang Long deleteByPrimaryKey deleteByExample AFTER insertSelective countByExample updateByExampleSelective map updateByExample updateByPrimaryKeySelective updateByPrimaryKey
E:\nuaa\1st_Year\1_code\LocalGit\mall\mall-mbg\src\main\resources\com\macro\mall\mapper\CmsSubjectMapper.xml,and criterion condition value secondValue listItem id category title pic product count recommend status create time collect read comment album pics description show forward name content select distinct from cms subject order by orderByClause where jdbcType BIGINT delete SELECT LAST INSERT ID insert into values categoryId VARCHAR productCount INTEGER recommendStatus createTime TIMESTAMP collectCount readCount commentCount albumPics showStatus forwardCount categoryName LONGVARCHAR update record set com macro mall mapper CmsSubjectMapper BaseResultMap model CmsSubject ResultMapWithBLOBs Example Where Clause oredCriteria criteria or valid noValue singleValue betweenValue listValue Update By example Base Column List Blob selectByExampleWithBLOBs CmsSubjectExample parameter null selectByExample selectByPrimaryKey java lang Long deleteByPrimaryKey deleteByExample AFTER insertSelective countByExample updateByExampleSelective map updateByExampleWithBLOBs updateByExample updateByPrimaryKeySelective updateByPrimaryKeyWithBLOBs updateByPrimaryKey
E:\nuaa\1st_Year\1_code\LocalGit\mall\mall-mbg\src\main\resources\com\macro\mall\mapper\CmsSubjectProductRelationMapper.xml,and criterion condition value secondValue listItem id subject product select distinct from cms relation order by orderByClause where jdbcType BIGINT delete SELECT LAST INSERT ID insert into values subjectId productId count update record set com macro mall mapper CmsSubjectProductRelationMapper BaseResultMap model CmsSubjectProductRelation Example Where Clause oredCriteria criteria or valid noValue singleValue betweenValue listValue Update By example Base Column List selectByExample CmsSubjectProductRelationExample parameter null selectByPrimaryKey java lang Long deleteByPrimaryKey deleteByExample AFTER insertSelective countByExample updateByExampleSelective map updateByExample updateByPrimaryKeySelective updateByPrimaryKey
E:\nuaa\1st_Year\1_code\LocalGit\mall\mall-mbg\src\main\resources\com\macro\mall\mapper\CmsTopicCategoryMapper.xml,and criterion condition value secondValue listItem id name icon subject count show status sort select distinct from cms topic category order by orderByClause where jdbcType BIGINT delete SELECT LAST INSERT ID insert into values VARCHAR subjectCount INTEGER showStatus update record set com macro mall mapper CmsTopicCategoryMapper BaseResultMap model CmsTopicCategory Example Where Clause oredCriteria criteria or valid noValue singleValue betweenValue listValue Update By example Base Column List selectByExample CmsTopicCategoryExample parameter null selectByPrimaryKey java lang Long deleteByPrimaryKey deleteByExample AFTER insertSelective countByExample updateByExampleSelective map updateByExample updateByPrimaryKeySelective updateByPrimaryKey
E:\nuaa\1st_Year\1_code\LocalGit\mall\mall-mbg\src\main\resources\com\macro\mall\mapper\CmsTopicCommentMapper.xml,and criterion condition value secondValue listItem id member nick name topic icon content create time show status select distinct from cms comment order by orderByClause where jdbcType BIGINT delete SELECT LAST INSERT ID insert into values memberNickName VARCHAR topicId memberIcon createTime TIMESTAMP showStatus INTEGER count update record set com macro mall mapper CmsTopicCommentMapper BaseResultMap model CmsTopicComment Example Where Clause oredCriteria criteria or valid noValue singleValue betweenValue listValue Update By example Base Column List selectByExample CmsTopicCommentExample parameter null selectByPrimaryKey java lang Long deleteByPrimaryKey deleteByExample AFTER insertSelective countByExample updateByExampleSelective map updateByExample updateByPrimaryKeySelective updateByPrimaryKey
E:\nuaa\1st_Year\1_code\LocalGit\mall\mall-mbg\src\main\resources\com\macro\mall\mapper\CmsTopicMapper.xml,and criterion condition value secondValue listItem id category name create time start end attend count attention read award type content select distinct from cms topic order by orderByClause where jdbcType BIGINT delete SELECT LAST INSERT ID insert into values categoryId VARCHAR createTime TIMESTAMP startTime endTime attendCount INTEGER attentionCount readCount awardName attendType LONGVARCHAR update record set com macro mall mapper CmsTopicMapper BaseResultMap model CmsTopic ResultMapWithBLOBs Example Where Clause oredCriteria criteria or valid noValue singleValue betweenValue listValue Update By example Base Column List Blob selectByExampleWithBLOBs CmsTopicExample parameter null selectByExample selectByPrimaryKey java lang Long deleteByPrimaryKey deleteByExample AFTER insertSelective countByExample updateByExampleSelective map updateByExampleWithBLOBs updateByExample updateByPrimaryKeySelective updateByPrimaryKeyWithBLOBs updateByPrimaryKey
